2014-07-09 02:17:22+00:00,When hookers take bitcoin call me.,2,0,0,0
2014-07-08 01:12:16+00:00,tried to sell my soul to the devil but he was only taking bitcoin,0,0,0,1
2014-07-07 23:45:34+00:00,wtf is bitcoin,1,0,0,0
2014-07-07 21:07:42+00:00,I know some folks wanted to donate through Bitcoin because its anonymous. The account is  1Jq1Hp7xszuezYnsEyWKxCgVioSbMMvEiA,0,0,0,2
2014-07-07 16:31:07+00:00,My most recent bitcoin node has been syncing the blockchain for over 12 hours. This is madness.,0,0,2,0
2014-07-04 18:51:48+00:00,Twitter Experiment. Can someone send me $100 USD in Bitcoin. Will Venmo you back right away: 1BmnhWefrt1b6eL5s9fPKDPbw6aYRMXcAZ,0,0,0,0
2014-07-04 03:03:46+00:00,The thing I'm looking forward to most about the next college football bowl season is being on Twitter during the Bitcoin Bowl (a real thing),2,0,0,0
2014-07-03 19:54:56+00:00,Who are your favorite Bitcoin people to follow on Twitter?,0,0,1,6
2014-07-03 14:20:40+00:00,So now I need to find a Bitcoin ATM in Las Vegas,0,0,0,0
2014-07-03 02:12:32+00:00,buy bitcoin and invest in the future its a good investment for you and your family...,0,0,0,3
2014-07-02 17:53:41+00:00,"The whole Silk Road thing being controlled by bitcoin, before it got big, prove that the biggest druggies are nerds",0,0,0,0
2014-07-02 17:35:50+00:00,"2014 was going to the year of the ""Rise of Bitcoin"", but it may have lost to ""Alleged Sexual Assault in Start-Up leadership"".",0,0,0,0
2014-07-02 15:55:37+00:00,Another first: a Bitcoin shirt spotted in the wild. 😩,0,0,1,0
2014-07-02 15:25:11+00:00,I bet at least half of business interns this summer can't explain what bitcoin is or why it's so important. Schoolllll bwoooo!!!!,0,0,1,1
2014-07-02 05:28:21+00:00,Does Hamas take bitcoin?,0,0,0,0
2014-07-02 02:10:11+00:00,"""Bitcoin is the Myspace of money"" -Bob",0,0,0,0
2014-07-01 23:47:34+00:00,"Can I elect to be paid in Bitcoin? ...better yet, can I be paid in actual barrels of oil?",0,0,0,0
2014-07-01 18:53:38+00:00,"What? overstock accepting bitcoin, that's pretty crazy yo.",0,0,0,0
2014-08-29 23:22:54+00:00,"This cafe uses bitcoin, I am definitely in Palo Alto.",1,0,1,0
2014-08-28 21:10:15+00:00,"Bitcoin holds value as true currency only in miner tipping. Until that inflects, value of bitcoin is independent of value created by ledger.",0,0,0,1
2014-08-26 19:15:58+00:00,I don't understand bitcoin... Mainly cause I haven't looked into it,0,0,1,0
2014-08-25 20:13:47+00:00,I have an interest in insulating my farm &amp; family from poor federal fiscal policy (inflation). Any farmers out there accepting bitcoin?,0,0,0,0
2014-08-24 19:32:02+00:00,Bitcoin doesn't create value. It stores it. Bitcoin companies create value by removing waste from stagnant industries (yes plural).,1,0,0,0
2014-08-23 15:34:07+00:00,The Bitcoin prepper might be the most deluded prepper.,1,0,0,1
2014-08-23 15:33:43+00:00,"“Let’s put some of this non-precious gas in the generator so we can boot up our laptops, establish a LAN, and exchange some Bitcoin!”",0,0,0,0
2014-08-23 15:33:17+00:00,"Ill give 100 bucks to the first person I see reading a paper newspaper at the coffee shop or on the bus. It'll be in bitcoin, of course.",2,0,1,0
2014-08-23 01:46:42+00:00,"Went from zero to bitcoin node in half an hour on Google Cloud Platform. Be afraid, Amazon Web Services.",0,0,0,0
2014-08-22 10:53:06+00:00,Bitcoin at $508.00 right now...,0,0,0,0
2014-08-22 00:20:15+00:00,"See, the thing about Bitcoin is - another Bacardi &amp; Coke please!",2,0,0,0
2014-08-21 23:50:08+00:00,IT'S LIKE BITCOIN FOR DOGS,0,0,1,0
2014-08-21 22:22:18+00:00,The Young brothers take over the bitcoin center: stay tuned.,0,0,1,0
2014-08-21 19:23:29+00:00,Bitcoin paranoid,4,0,0,0
2014-08-21 17:58:46+00:00,i hope ur twitter account is making you lots of money or bitcoin,1,0,0,0
2014-08-20 01:15:51+00:00,Turn your Xbox One into a Bitcoin Miner,1,0,0,0
2014-08-19 23:31:28+00:00,Stellar as a unit of exchange. Bitcoin as a store of value. #2014,0,0,0,0
2014-08-19 23:30:49+00:00,At a person who follows Bitcoin don't discount Stellar. Lots of smart people working with it. No idea if that makes it valuable.,0,0,0,0
2014-08-19 15:36:57+00:00,"""What evidence do you have that bitcoin is money?"" Well your honor I bought drugs with it [Courtroom erupts into surprised murmurs] ""Order!""",0,0,0,0
2014-08-19 00:20:38+00:00,"genuine question: without Bitcoin, in 2014 how could you electronically send me $1 or $1MM after 9pm, ready to be spent right away?",1,0,3,5
2014-08-18 22:40:34+00:00,Anyone have acr$? Have PayPal/bitcoin/venmo/BoA/chase qp/cash at foxwoods,2,0,2,1
2014-08-18 17:28:36+00:00,"Bitcoin price is back down where I like it, time to re-buy, slowly. $100 today.",0,0,0,0
2014-08-18 01:25:27+00:00,Had the surprise opportunity in Vegas to pay for crepes with bitcoin but couldn’t because I deleted coinbase from my phone :(,1,0,0,0
2014-08-16 00:38:56+00:00,you’ll all feel preeeeeetty stupid in a year when i become a Bitcoin Millionaire,1,0,0,0
2014-08-15 21:06:51+00:00,Just bought 10 grand in Bitcoin,0,0,1,0
2014-08-15 16:57:37+00:00,I think my 2 bitcoin mining device are on their last leg of profitability.   In total i spent $110 and made $22,0,0,0,0
2014-08-15 07:45:48+00:00,is someone writing atlas shrugged for bitcoin yet,0,0,0,0
2014-08-15 02:43:33+00:00,I just cannot grasp the concept of Bitcoin.,0,0,0,0
2014-08-15 02:12:34+00:00,"Bitcoin is at $517 now, glad I bought some more at $536 yesterday anyway tho, still hasn't got me worried, not even down to $500 yet",0,0,0,0
2014-08-14 23:28:09+00:00,Someone stop bitcoin plz .,0,0,0,0
2014-08-14 21:53:45+00:00,"That’s right everybody I’m back :),using this as my main again for a while,still got bitcoin stuff and iPhone walls haha,lil break needed :)",2,0,2,1
2014-08-14 16:39:58+00:00,Anyone at foxwoods have cash (like 1k+) to trade for bitcoin or PayPal to save me a trip to the bank?,1,0,0,1
2014-08-14 15:25:30+00:00,"But Bitcoin is not just exciting, it is also a very powerful revolution that removes currency from institutions, and gives control to you.",2,0,1,1
2014-08-14 08:35:30+00:00,living life on the edge... almost got margin called thanks to bitcoin's nonsensical volatility,0,0,1,1
2014-08-14 00:55:22+00:00,"I hear that google, apple, amazon and paypal are all flirting with enabling Bitcoin in their wallets. Who leads?",0,0,0,0
2014-08-12 19:07:43+00:00,The person who created bitcoin is stupid rich,0,0,1,0
2014-08-12 07:03:15+00:00,To go back into Bitcoin or not. Hmmmm.,2,0,0,0
2014-08-12 00:35:00+00:00,"The more I come to understand Bitcoin, the more I realize how much it matters.",2,1,0,0
2014-08-11 17:01:18+00:00,Am I the only one that finds Bitcoin Regulation very important but boring at the same time?,0,0,0,0
2014-08-11 01:57:54+00:00,"1/It's really hard to create Bitcoin software. Months of laying a foundation that communicates with the Blockchain, then building your app.",0,0,1,0
2014-08-09 15:27:55+00:00,Really thinking about buying a bitcoin.,0,0,0,1
2014-08-09 02:23:51+00:00,Bitcoin wallet developers must nag the users when necessary to remind them to backup their money.,1,0,0,3
2014-08-09 02:21:48+00:00,millions will be lost forever on people who think their bitcoin wallet keys live in the cloud and not their phone due. (cont),1,0,0,1
2014-08-08 18:12:24+00:00,I need a bitcoin miner,0,0,0,0
2014-08-08 02:54:26+00:00,AMERICA WAS MADE FOR THE BITCOIN,0,0,0,0
2014-08-08 02:18:04+00:00,What ever happened to bitcoin lol,1,0,0,0
2014-08-07 01:38:59+00:00,Met some really interesting people at the Pitt Bitcoin Meet up. Looking forward to following up with some of you guys!,0,0,0,0
2014-08-07 01:06:00+00:00,I've made some decent $$$ with bitcoin but the culture continues to keep me laughing,0,0,0,0
2014-08-06 16:46:46+00:00,It’s funny to see how freaked out HN gets at the *abstract idea* of an unpublished essay critiquing Bitcoin.,10,0,1,0
2014-08-05 06:25:52+00:00,feels like bitcoin price is about to jump again,0,0,0,1
2014-08-04 15:51:16+00:00,Should have invested in Bitcoin a year ago. $585 per coin now. Damn.,0,0,0,0
2014-08-04 03:32:59+00:00,"You guys, I have solved the Cubs money issues! Ready for it? Drumroll...Bitcoin! You're welcome.",5,0,2,0
2014-08-03 23:30:13+00:00,I appreciate how bitcoin terminology resembles gambling terminology as it keeps me from getting involved with either,1,0,0,0
2014-08-03 21:34:16+00:00,"So many flashing lights &amp; sounds &amp; promiscuously dressed women here, but all I'm thinking about is how Vegas accepts Bitcoin now.",0,0,0,0
2014-08-03 19:19:44+00:00,Why can't a bitcoin protocol exist in top of something like SETIATHOME?,2,0,0,0
2014-08-03 19:17:06+00:00,"The potential in Bitcoin is not currency but what folks in the valley are doing, such as making a Dropbox replacement based on the protocol.",0,0,0,0
2014-08-03 04:59:23+00:00,So I might possibly get paid for a project in bitcoin. Pretty cool,0,0,0,0
2014-08-02 20:59:12+00:00,Bought pillows with bitcoin today. Am I representative of the average internet user?,6,0,2,0
2014-08-02 17:12:51+00:00,"“Lay not up for yourselves treasures upon earth, where moth &amp; rust doth corrupt, &amp; where thieves break through &amp; steal.” 
—a pal on bitcoin",1,0,1,0
2014-08-02 16:12:05+00:00,Ever even owned a Bitcoin or plenty?,0,0,0,0
2014-08-01 05:15:40+00:00,"Year 2025 the big depression, caused when a quantum computer forked the bitcoin network, markets panic, USA blame China.",0,0,0,0
2014-08-01 02:00:17+00:00,Bitcoin: No fraud! ( unless you're the consumer and never receive your goods),0,0,1,0
2014-08-01 00:49:06+00:00,At TechXploration bitcoin block chain technology meetup Hosted by PayPal,0,0,0,0
2014-09-29 15:48:32+00:00,"Man I gotta pee, she. She Bitcoin😒😴😬",0,0,0,0
2014-09-29 02:31:44+00:00,Sometimes online I'll see people taking about ello. My only question is do they take bitcoin,0,0,0,0
2014-09-29 01:29:53+00:00,What could Dropbox possibly be doing that demands 110% CPU… are they now clandestinely mining Bitcoin as I download my files?,0,0,0,0
2014-09-29 01:08:14+00:00,I hate how volatile bitcoin is so much,0,0,1,0
2014-09-28 19:16:12+00:00,The bitcoin protocol enables a decentralized database to track ownership of assets. Data is an asset. Therefore should be tied to blockchain,0,0,0,1
2014-09-28 17:45:01+00:00,"so speaking of north korea. why haven't they made their own bitcoin-like crypto currency? you know... ""KleptocracyKoin"" or something.",0,0,1,0
2014-09-28 07:08:30+00:00,Who's awake? I've just been struck by an utterly brilliant idea for bitcoin.,4,0,1,0
2014-09-28 00:08:28+00:00,well 250  fliers 20 pryto bitcoin cards gone in a less than 1 hour today on freemont.Damn Prypto is getting popular,0,0,0,0
2014-09-26 17:18:42+00:00,Today would also be a good day to buy your first bitcoin.,0,0,0,0
2014-09-26 15:42:15+00:00,Introduced my mother to virtual currency this week...taking bets: how long till she asks if she can pay for Mafia Wars with Bitcoin?,0,0,0,0
2014-09-26 15:11:20+00:00,BITCOIN and bitcoin are differents concepts. BITCOIN is the P2P transactions; bitcoin is the currency associate with BITCOIN processes.,0,0,0,0
2014-09-26 02:14:39+00:00,So I just bought $1 worth of Bitcoin from an ATM machine.,5,0,1,2
2014-09-25 19:45:41+00:00,"Just saw a clearly homeless guy in downtown San Francisco holding sign that says ""I accept PayPal and bitcoin"". Wow, just wow.",0,0,0,0
2014-09-25 06:05:29+00:00,How much of the bitcoin block chain is simply lost and unrecoverable? Where people simply lost their wallets?,0,0,1,0
2014-09-25 04:01:55+00:00,"I'm gonna have to turn this into linux box to mine bitcoin.  So long VirtualBox.  Goodbye, Mr. Gates.  [Ctrl+Alt+MyDikMuthaFuka]",0,0,0,0
2014-09-24 15:47:39+00:00,"Blocked somebody for mentioning bitcoin, this is serious man.",1,0,0,0
2014-09-24 15:36:35+00:00,"Came dangerously close to learning what a bitcoin is, but I held strong to what I believe in. And what I believe in is never knowing.",3,0,0,1
2014-09-24 12:42:47+00:00,Paypal now accepts Bitcoin. I predict legal regulations in less than a year. For now we have a global currency not controlled by anyone.,0,0,0,0
2014-09-24 05:02:23+00:00,Bitcoin just went up $30 due to the airstrikes in Syria.,1,0,0,0
2014-09-24 02:39:41+00:00,"Que dije ayer acerca de los fake sell walls en China? claro que eran fake, a shaking of weak hands... !0% up today Bitcoin!",0,0,0,0
2014-09-24 00:29:59+00:00,So can you Bitcoin nerds hurry up and make Silk Road ✔️Prime a thing?,2,0,0,1
2014-09-23 22:25:32+00:00,If I accidentally swallow a bitcoin should I go to urgent care?,0,0,0,0
2014-09-23 19:36:24+00:00,Bitcoin + Paypal,0,0,0,0
2014-09-23 07:19:10+00:00,Might buy a bitcoin on my paycheck after the next 🙌,0,0,0,0
2014-09-23 00:09:50+00:00,"Spotted at Starbucks: a white man with dreads at an otherwise-unmarked laptop with a giant ""Bitcoin"" sticker",3,0,0,0
2014-09-22 21:10:13+00:00,"Tim, does tranfer bitcoin, not as much as he used to,nobody else does, legal reasons",0,0,0,0
2014-09-22 14:30:08+00:00,The Bitcoin Bowl is still a real thing,0,0,0,0
2014-09-22 02:54:33+00:00,"Nice Bitcoin rally on Okcoin, good morning China!",0,0,0,0
2014-09-21 04:48:52+00:00,"Talking to someone about Bitcoin, and the fear just poured out of this guy like a fountain. Sometimes I forget the effect it can have",0,0,0,0
2014-09-20 21:25:15+00:00,Want to buy dinner with bitcoin. Hello Orlando,4,0,1,0
2014-09-20 20:09:32+00:00,I'm not an expert but I would say now is a good time to pick up your first bitcoin,0,0,0,0
2014-09-20 04:45:15+00:00,"Darn you Bitcoin, why did I buy at 600?",0,0,0,0
2014-09-19 23:45:44+00:00,I bought one whole dollar in bitcoin. I am one of the cool kids now.,0,0,1,0
2014-09-19 20:44:39+00:00,The Insurodollar will do more for labor than the Bitcoin. Leverage for Labor in conflict with capital will come from the Insurodollar money.,0,0,0,0
2014-09-19 19:35:41+00:00,Come on bitcoin..,0,0,0,0
2014-09-19 19:09:16+00:00,"SF bus fare is up to $2.25; tech shuttle fee still $1 per stop. Luckily, MUNI will now accept Bitcoin and/or truffle fries as payment.",8,0,2,6
2014-09-19 15:09:31+00:00,"Silver down, Gold down, Bitcoin slaughtered. Time to buy!",0,0,0,0
2014-09-19 02:08:02+00:00,Another 10% down in bitcoin. Bitcoin falling apart over the past month. Something brewing...,0,0,1,0
2014-09-18 21:19:08+00:00,"In a few years, trying to pay for something using cash will seem just as awkward as bitcoin does today.",1,0,0,0
2014-09-18 17:09:19+00:00,Can't wait for Independent Scotland to adopt Bitcoin as its official currency.,0,0,0,1
2014-09-18 16:50:14+00:00,There's a bitcoin machine in the building where I work. You can buy or sell.,1,0,0,0
2014-09-18 16:37:32+00:00,Is there a reason Bitcoin is crashing lately?,0,0,0,1
2014-09-18 14:22:22+00:00,"Even if you view the prob of wide Bitcoin use as very low, the potential impact is so huge that you have to at least acknowledge it.",0,0,0,0
2014-09-18 14:21:00+00:00,Bernstein call this morning highlights 6 disrupters of payments…and Bitcoin not even mentioned?,0,0,0,0
2014-09-18 09:07:27+00:00,What's that secret internet website that sells drugs and porn in exchange for bitcoin?,0,0,0,0
2014-09-17 15:42:51+00:00,"If Scotland needs a new currency, why don't they just go with Bitcoin?",0,0,0,0
2014-09-16 22:04:47+00:00,This place has a bitcoin ATM 😂,1,0,0,0
2014-09-16 21:44:22+00:00,"The real power of Bitcoin is in the blockchain, the revolutionary innovation that permits establishing consensus in",0,0,1,0
2014-09-16 18:04:25+00:00,"Bitcoin dilemma: The countries that could use Bitcoin the most will prohibit it. (ex Bangladesh, North Korea, Russia etc.)",1,0,0,1
2014-09-15 19:31:27+00:00,"In 2016, I'll vote for the Bitcoin party.",0,0,0,0
2014-09-14 02:52:56+00:00,God. You tip one guy in BTC and make one tweet about it and suddenly they think you're all about Bitcoin.,0,0,0,0
2014-09-14 01:15:36+00:00,"..almost $10 worth of bitcoin that I bought to a secure vault, so I think I'll hedge with some more litecoin.",0,0,1,0
2014-09-13 02:42:13+00:00,Closing random thought of the day. I saw an actual Bitcoin machine today. We're all about to be Borg.,0,0,0,0
2014-09-12 19:11:52+00:00,Conversations on bitcoin always seem so apocalyptic.,0,0,1,1
2014-09-12 14:25:46+00:00,I bet there are a lot of vape shops that accept Bitcoin.,10,0,2,2
2014-09-11 19:33:52+00:00,"I hope Reddit karma becomes the new Bitcoin, and then I can quit my job.",2,0,1,1
2014-09-11 16:08:02+00:00,I'm looking to setup a Bitcoin ATM here in Arlington. PM me if you know any local businesses that might interested in hosting.,0,0,0,0
2014-09-11 00:26:40+00:00,Bitcoin is the most frustrating thing I have ever used in my life 😠,6,0,0,0
2014-09-11 00:25:47+00:00,Transfer stocks to bitcoin,0,0,1,0
2014-09-10 15:20:59+00:00,Will Apple Pay support Bitcoin? That’s the question no one cares about.,2,0,0,1
2014-09-10 06:49:01+00:00,"Can't wait for the day ""Credit, Debit, or Bitcoin""",0,0,0,0
2014-09-10 02:17:12+00:00,How can Apple launch Apple Pay without mandatory Bitcoin requirement? What currency will we use to buy things?,0,0,0,0
2014-09-09 17:46:18+00:00,Trolling friends whenever their Apple livestream feed craps out is DELIGHTFUL. “Bitcoin in the wallet? OHMIGOD!” :-D,1,0,0,0
2014-09-09 15:39:41+00:00,"If the new iPhone has a bitcoin ATM and laser beams, I'll consider it.",2,0,1,0
2014-09-09 02:17:46+00:00,Any of my followers know anything about bitcoin?,0,0,0,0
2014-09-08 19:59:41+00:00,The new PayPal app supports Bitcoin?!? *jackiechanconfusedface.jpg*,2,0,0,0
2014-09-08 18:03:33+00:00,"Bitlicense has no jurisdiction regulating Bitcoin! it breaks US constitution Interstate Commerce Clause, only congress can regulate it.",0,0,0,0
2014-09-08 17:59:01+00:00,Whoa. I'm not sure bitcoin can handle any more good news. Another price drop coming? Haha,0,0,0,0
2014-09-08 15:08:08+00:00,Bitcoin today is like an IP address waiting for a domain/DNS to make it mainstream,24,0,5,6
2014-09-07 19:31:08+00:00,It's like bitcoin but for collection metadata,0,0,0,0
2014-09-07 07:45:52+00:00,"I have abt $16 worth of bitcoin in 2 different new ventures, didn't want to give up totally on that, still a slight chance on profiting :)",0,0,0,0
2014-09-07 07:23:36+00:00,"abt 60% of my bitcoin earnings I've been sending to one of my personal account wallets for savings, along with abt half of the bitcoin I buy",0,0,0,0
2014-09-07 07:00:54+00:00,"I converted my bitcoin earnings from my various btc jobs for awhile to litecoin for diversification, so I now have $3 worth of litecoin",1,0,0,0
2014-09-06 23:21:04+00:00,"If Apple has a mobile payment system... Can they integrate Bitcoin?

Please? That would be so cool.",0,0,0,0
2014-09-06 20:27:29+00:00,"""So what are you working on?"" ""Get this: Bitcoin Fantasy Football.""",5,0,1,0
2014-09-05 02:55:48+00:00,Freebie: TCP over CB. Bitcoin for truckers.,0,0,0,0
2014-09-04 20:21:17+00:00,Come by the Williams College Bitcoin Club table at the Purple Key Fair tonight!!,1,0,0,0
2014-09-04 19:53:03+00:00,Linux Wallet will be available today on our website !!!  Also an updated wallet with the new Bitcoin Core will be available later this week!,0,0,0,0
2014-09-04 02:10:10+00:00,Thought you might all like to know that someone in Minneapolis drives a Beemer with the license plate BITCOIN.,3,0,0,0
2014-09-03 22:26:22+00:00,Well that's weird. I was given a bitcoin and a note from some iCloud hacker asking me to *stop* taking naked selfies,9,0,1,6
2014-09-02 19:27:24+00:00,"""After all, it’s the perfect Internet scandal: sex, Bitcoin, shadowy hackers and long-reigning Internet darling Jennifer Lawrence.""",1,0,0,0
2014-09-02 13:44:43+00:00,Reciprocity may be as big an Internet currency as Bitcoin.,0,0,0,0
2014-09-02 06:24:25+00:00,"Oh sweet, I finally recovered my bitcoin wallet from back in 2011! It’s probably almost empty, waiting for bitcoin-qt to sync to find out",2,0,3,1
2014-09-02 05:41:37+00:00,"""stuff(i'm not the hacker, just a collector), and the money (i paid a lot via bitcoin as well to get certain sets when this stuff was being""",0,0,0,0
2014-09-02 05:40:56+00:00,"""People wanted s*** for free. Sure, I got $120 with my bitcoin address, but when you consider how much time was put into acquiring this""",0,0,0,0
2014-09-02 03:02:22+00:00,"""Your smile is like a bitcoin."" Well, guys, it's been a nice run but I'm a lesbian now.",7,0,2,0
2014-09-01 23:48:56+00:00,That's quite a drop 4 bitcoin.,0,0,0,0
2014-09-01 23:41:16+00:00,"If  Earth was hit by a EMP or Sunflare, and we were thrown into the Stone Age, what would happen to paper money, and Bitcoin?",0,0,0,0
2014-09-01 23:32:07+00:00,Please tell me that people who are not bankable are not the prospect customer for bitcoin?! That's plain stupid.,0,0,0,0
2014-09-01 18:54:29+00:00,Someone recognized my bitcoin shirt. Going mainstream!,0,0,0,0
2014-09-01 02:38:27+00:00,Wait.. Wait.. For bitcoin lmao,0,0,0,0
2014-10-30 17:19:46+00:00,WHAT THE HELL IS A BITCOIN,2,0,2,0
2014-10-30 15:48:00+00:00,"historically speaking, mathematical breakthroughs are usually economically worthless for centuries. Bitcoin is proving to be different",0,0,0,0
2014-10-30 08:50:44+00:00,"Bitcoin and farm business are a perfect marriage.
Farmers will thrive on receiving a currency for their produce that appreciates in value.",0,0,0,0
2014-10-29 21:57:21+00:00,Looking forward to Bitcoin army,22,0,1,9
2014-10-29 18:44:38+00:00,1st there was Bitcoin. Now they have created the Titcoin where you can take a picture of your tits for a virtual coin that can be redeemed,1,0,1,0
2014-10-29 15:18:49+00:00,"Unlike Bitcoin, I await which of the retailers will break with MCX first….",1,0,3,1
2014-10-29 05:54:53+00:00,"""ytcracker - Bitcoin Baron"" is awesome and hilarious. Check it out.",0,0,0,0
2014-10-27 20:45:24+00:00,"WCP's b/c todd has no net-must tweak Sharebuild, Bitcoin, etc b4 rush.  Outcome ob. It's a win b/c penny stocks are all I can afford anyway.",0,0,0,0
2014-10-27 19:16:54+00:00,Bitcoin bathmat,0,0,0,0
2014-10-27 13:57:46+00:00,Good morning.    Bitcoin is cash with super powers.,2,0,0,0
2014-10-26 22:57:05+00:00,"Make more money developing the alt coin side of Bitcoin, it is “our” only hope for a future with anonymity.",0,0,0,0
2014-10-26 19:17:31+00:00,"Announcement:
I'm now accepting and ONLY transacting with bitcoin.
I believe this is a cornerstone for a sustainable farm.",3,0,0,0
2014-10-26 07:48:01+00:00,"bitcoin now trading at $352.41, 279.15euros, 2147.52 japanese yen and 232.17british pounds sterling",0,0,0,0
2014-10-25 17:29:16+00:00,CVS &amp; Rite-Aid not accepting ApplePay or Google Wallet so they can do their own thing. Fuck. We really need Bitcoin.,1,0,0,0
2014-10-25 05:44:49+00:00,The US Marshalls recently auctioned off $18 million worth of confiscated bitcoin from accused arrested federal criminal defendants,0,0,0,0
2014-10-25 05:08:27+00:00,"&lt;cont&gt;capability (called Hashes or Hashrates) for Bitcoin is now in THS range, from MHS and then Gigahash (GHS) range earlier &lt;sigh!&gt; :P",0,0,0,0
2014-10-25 05:05:53+00:00,Bitcoin Individual (Can include large corporations with HUGE Data Centers with Tons of Powerful Server-Grade Server Computers) Mining&lt;cont&gt;,0,0,0,0
2014-10-25 02:20:18+00:00,Who's making Bitcoin,0,0,0,0
2014-10-24 22:34:01+00:00,Bitcoin: Minnesota sXe hardcore since 2014.,0,0,0,0
2014-10-24 22:24:23+00:00,Bitcoin.,0,0,0,0
2014-10-24 21:07:17+00:00,"a full Bitcoin is now worth $358.53, down a little again, darn it lol :)",0,0,0,0
2014-10-23 19:19:43+00:00,Another benefit of the digital cryptocurrency bitcoin: no Ebola,0,0,0,0
2014-10-23 12:49:11+00:00,"If you consider yourself a techie and have not tried Bitcoin, try it this holiday season for gadget purchases, you'll love the experience.",0,0,2,0
2014-10-23 03:43:08+00:00,Anyone interested in 2 tickets for Little Dragon at Fox in Oakland on Friday? I accept bitcoin.,1,0,1,0
2014-10-23 02:08:41+00:00,sorry but wtf is a bitcoin?,1,0,1,0
2014-10-22 14:57:38+00:00,"note ot self, reboot bitcoin beowulf cluster..",0,0,0,0
2014-10-22 01:00:38+00:00,Dear traffic on Wolfe Rd.  I'd really like to make the Bitcoin Meetup in Sunnyvale.  Kthxbye,0,0,0,0
2014-10-21 19:17:37+00:00,We need to create a buffer for ourselves from destructive fiscal policy. Are there any other farmers trading produce for silver or bitcoin?,1,0,0,0
2014-10-21 19:02:58+00:00,"Thinking about the future.
Are there circles in my region/community that are trading goods and services with bitcoin and/or silver?",0,0,0,0
2014-10-21 09:21:27+00:00,"..that gets exchanged, so I don't need to add any bitcoin to meet the minimum exchg withdraw amount  I'm moving ahead full steam no stoppin",0,0,0,0
2014-10-20 21:35:48+00:00,"BitCoin is an unregulated get rich scheme. Instead of griping about NY regulating them, we should ask other states to regulate it as well.",0,0,0,0
2014-10-19 05:21:20+00:00,These guys are trying to purchase beers with bitcoin. 😑,1,0,1,0
2014-10-19 01:16:10+00:00,Of course the crazy security online lock company I’m buying from takes Bitcoin. Of course!,1,0,0,0
2014-10-18 19:08:44+00:00,being a Bitcoiner and losing your wallet for 2 days can really get to your nerves. Sucks not being able to use Bitcoin for retail/food yet.,1,0,3,0
2014-10-18 16:11:06+00:00,Bitcoin# -- currency for people who don't like cash from people obsessed with money#?,1,0,0,0
2014-10-18 00:24:17+00:00,theres at bitcoin atm at the local 24 hour coffee house,0,0,0,0
2014-10-17 19:31:11+00:00,I wish something like Bitcoin would work just so that micropayments for articles weren't a huge pain in the ass.,0,0,0,1
