2014-02-24 16:09:06+00:00,If you ain't talkin Bitcoin I don't wanna talk.,1,0,0,1
2014-02-24 15:03:54+00:00,Bitcoin price crashes amid regulatory glare; 121 virtual currencies join forces,0,0,0,1
2014-02-24 06:10:03+00:00,So is the problem with Mt. Gox or is it with Bitcoin itself?,0,0,1,0
2014-02-24 04:13:59+00:00,So is Bitcoin an Actual Coin or Not?,0,0,0,0
2014-02-23 13:39:55+00:00,Can Someone Pulleez Post A Pic of this Bitcoin Everybody's Talkin About?!!!,1,0,1,0
2014-02-23 00:53:46+00:00,can't a young homie buy a bitcoin anymore? seriously tho,0,0,0,2
2014-02-22 23:51:05+00:00,Gonna buy a bitcoin this year.,0,0,0,0
2014-02-22 20:10:07+00:00,Andreev paper guess we will see bitcoin escrow soon? Another way to elim a middleman,0,0,0,0
2014-02-22 20:06:48+00:00,So colored coins allow u to add a timestamp to your bitcoin transaction that can be released on completion of service.,0,0,0,0
2014-02-22 19:05:21+00:00,If candy bracelets are the next bitcoin I'll be retiring on my own island.,8,0,0,3
2014-02-22 18:09:54+00:00,Bitcoin is a world currency?,1,0,0,0
2014-02-22 09:15:47+00:00,"big things hackers are excited about now and can't articulate why – Bitcoin and 3D printing""
- Paul Graham",0,0,1,0
2014-02-22 04:32:14+00:00,Goldman Sachs assessing bitcoin makes me think less of the Monopoly money movement,1,0,0,0
2014-02-22 04:32:11+00:00,Pho-coin: Exclusively mobile bitcoin. Based in Vietnam.,4,0,0,0
2014-02-21 23:59:33+00:00,Who here actually has or has used bitcoin? Wondering if it's a fad or here to stay??,0,0,2,1
2014-02-21 23:09:13+00:00,i’m hoping the reason apple pulled bitcoin wallets had to do with their SSL authentication bug…and not a stance on bitcoin,1,0,0,0
2014-02-21 22:51:47+00:00,"I would honestly gamble more in the bitcoin market over the actual stock market. Greater risk, but higher reward!",0,0,0,0
2014-02-21 20:47:23+00:00,Bitcoin is here to stay and will continue to grow globally and into retail mainstream,0,0,0,0
2014-02-21 19:22:30+00:00,Say NO to bitcoin,0,0,0,0
2014-02-21 17:46:52+00:00,"And ""owning a Bitcoin"" sounds more substantial than ""having an address with a balance"".",0,0,1,0
2014-02-21 17:41:38+00:00,"Half the challenge of understanding Bitcoin is undoing all the faulty associations caused by the terms ""coin"" and ""mining"".",1,0,0,0
2014-02-21 15:38:11+00:00,just found a bitcoin on the street.,0,0,0,0
2014-02-21 02:58:08+00:00,"Bitcoin crashes and UNC Duke game, and I'm on the road with Edge. Yay.",2,0,0,0
2014-02-21 01:37:16+00:00,Bitcoin - Cuz that shit's all fake anyways.,0,0,0,0
2014-02-21 01:25:50+00:00,Imma get rich off this bitcoin shit befo yall even get hip...,1,0,0,0
2014-02-20 21:12:32+00:00,"Bitcoin miners, please accept my feeless transaction into the blockchain so this dude will see its confirmed, and leave my house.",0,0,0,0
2014-02-20 21:08:25+00:00,"$575 is probably a good price to buy Bitcoin at. This tweet is going to be hilarious to my grandchildren, one way or the other.",1,0,1,1
2014-02-20 20:23:28+00:00,"Also, there are no rules in space, so any bitcoin mined there is free from regulation!",0,0,2,0
2014-02-20 20:22:25+00:00,Did you know that because of the ambienttemperature of space it's more efficient to mine bitcoin there? Back our Kickstarter!,2,0,3,1
2014-02-20 14:09:55+00:00,Just bought my first bitcoin. Surprisingly easy process.,0,0,0,0
2014-02-20 07:52:33+00:00,Don't buy. They fluctuate more than stocks. And unless you love near a bitcoin ATM you won't have any tangible assets.,0,0,0,0
2014-02-20 07:29:57+00:00,Btc just hit 200 on mtgox. The downstairs Bitcoin Center got rid of the huge tv screen with charts in the front they had weeks ago.,0,0,0,0
2014-02-20 06:42:20+00:00,I really should look more into Bitcoin. I could make some serious money.,0,0,1,0
2014-02-20 03:47:17+00:00,"I told him that if he starts wearing a fedora and talking about bitcoin, we are done professionally.",0,0,0,0
2014-02-20 02:40:42+00:00,Bitcoin millionaire,0,0,0,0
2014-02-19 22:45:04+00:00,My favorite thing about bitcoin is how the media uses the same photo of physical coins embossed with a bitcoin logo. Why not cowry shells?,0,0,0,0
2014-02-19 22:24:18+00:00,Irish tech media spinning from bitcoin to IMEI surveillance to IM app expertise so rapidly they could be an alternate energy source.,1,0,0,1
2014-02-19 18:51:50+00:00,this emoji is actually a bitcoin at full face value.,0,0,0,0
2014-02-19 18:45:43+00:00,Bitcoin is blowing my mind right now,0,0,0,1
2014-02-19 17:38:29+00:00,"So, has Bitcoin hit critical hype yet? Watching a LibertyTeller get installed and reporters swarm over it at South Station.",1,0,1,0
2014-02-19 16:54:32+00:00,I agree with many Bitcoin supporters that crypto currency has the potential to disrupt markets even more than the Internet has done,1,0,0,1
2014-02-19 14:58:49+00:00,Rock salt is the new bitcoin.,0,0,1,0
2014-02-19 13:46:29+00:00,"Western Union is solid, consistent, highly profitable business. Run will end as bitcoin overcomes growing pains, becomes remittance defacto.",1,0,0,0
2014-02-19 03:07:57+00:00,"gonna get a bitcoin tattoo

a tattoo made out if bitcoins

paid for in litecoins

sponsored and invested by kevin rose",1,0,0,0
2014-02-19 03:06:16+00:00,"Just created a TweetBot filter for the keyword, ""bitcoin.""  Sweetness.",0,0,0,0
2014-02-19 02:35:16+00:00,"This dude is trying to talk to his date about BitCoin. True fucking story.

I feel like I should intervene.",2,0,1,0
2014-02-19 00:27:06+00:00,"The energy in Silicon valley is electrifying. several game changers on the horizon bitcoin, drones, cloud-genomics, etc.",0,0,0,0
2014-02-18 23:26:35+00:00,"Does Dwolla compete with bitcoin, or are they playing in completely different arenas?",0,0,0,0
2014-02-18 23:25:51+00:00,"Time to figure out bitcoin. *Why* does it need to exist?

I understand that it is important, and could reach huge scale. But, why should it?",1,0,1,0
2014-02-18 21:11:39+00:00,Voting for US president is about as real as voting for the next American Idol winner. Do somthing real and be a node in the bitcoin network.,3,1,0,1
2014-02-18 14:14:10+00:00,$bitcoin prices have fallen around 30% after major exchanges close from security issues. Any one own any?,0,0,0,0
2014-02-18 13:59:56+00:00,"One of those morning mtngs where you cover life, love and bitcoin.",3,0,0,0
2014-02-18 05:11:34+00:00,Perhaps Bitcoin was developed as a way to get the younger generation interested and learning about economics and currency trading.,0,0,0,0
2014-02-17 23:18:53+00:00,the bitcoin exchange makes crime more common and law enforcement a very dubious and bumpy ride if ever,0,0,0,0
2014-02-17 23:13:41+00:00,Had an interesting conversation about Bitcoin with my accountant today. Seen as potentially valuable exchng medium but high risk investment.,1,0,1,0
2014-02-17 22:57:34+00:00,"Who's using bitcoin? If you're not, what's keeping you away? I'm exploring but leary of crypto currency. You?",1,0,0,0
2014-02-17 20:44:37+00:00,Bitcoin crash 0.o,0,0,0,0
2014-02-17 17:00:48+00:00,"Bitcoin Touches $220 On Formerly Dominant Exchange MtGox — After 60% Plunge: Bitcoin is currently trading at near $250, according to ...",0,0,0,0
2014-02-17 14:58:09+00:00,"“The Oxford Dictionary 2013 word of the year was ""selfie."" It beat out ""bitcoin"" and ""twerk.""",0,0,0,0
2014-02-17 14:04:08+00:00,"I try to remind myself that bitcoin isn't a cult, but that's difficult sometimes.",0,0,0,0
2014-02-17 04:43:23+00:00,"Paid email service for people sick of spam, users get paid for reading and messages are guaranteed to be read. Paid and encrypted w/ bitcoin",0,0,0,0
2014-02-17 03:50:09+00:00,Apple to buy tesla? Not betting even 0.1 bitcoin on it,1,0,1,1
2014-02-17 03:43:54+00:00,I am going to start commodities trading in frozen concentrated bitcoin.,0,0,1,0
2014-02-17 03:42:16+00:00,I'm pretty sure I'll never really understand what Bitcoin really is.,1,0,0,1
2014-02-17 01:25:03+00:00,"Hey investors, is there a legit way to short BITCOIN?",3,0,4,0
2014-02-17 00:02:46+00:00,"In for a few more bitcoin on gox, under $300 per btc. Still short on btce.",1,0,0,0
2014-02-16 22:58:14+00:00,Leave it to Business Insider to try to create false alarm in the BitCoin market pointing out MTGOX pricing is down at $220,0,0,1,0
2014-02-16 22:11:51+00:00,How many people use bitcoin?,0,0,0,0
2014-02-16 21:53:37+00:00,Huge bitcoin buying opportunity now. It's not going away.,0,0,2,0
2014-02-16 20:09:47+00:00,"Apple's rejection of bitcoin apps doesn't support ""The crazy ones. The rebels. The ones who see things differently."" It's for the status quo",3,0,1,2
2014-02-16 19:42:19+00:00,"a superhero names ""Bitcoin Bill""",1,0,0,0
2014-02-16 19:20:31+00:00,Fascinated to hear such polarized opinions on Bitcoin. I wish our global econ professor talked about this in the class soon.,0,0,0,0
2014-02-16 13:09:22+00:00,They should remake Office Space and have them launder their money via bitcoin.,0,0,0,0
2014-02-16 04:11:05+00:00,"In a Bitcoin world, what will business owners frame to commemorate their first transaction? A printout of an Instagram of a QR code?",3,0,4,0
2014-02-15 20:01:27+00:00,Turns out Bitcoin was actually a crowd-funded bug bounty program.,1,0,0,1
2014-02-15 18:49:22+00:00,The crypto community needs a new currency that rewards rather than punishes increasing decentralization. Bitcoin is not that currency.,0,0,0,1
2014-02-15 18:34:06+00:00,Who has Bitcoin? Anyone? Just curious.,0,0,0,0
2014-02-15 18:29:59+00:00,Who has bitcoin? Anyone? Just curious.,0,0,0,0
2014-02-15 16:42:29+00:00,How many votes do I get for a bitcoin though?,3,0,0,0
2014-02-15 15:58:31+00:00,&lt;--------- Bitcoin Perseverator,0,0,0,0
2014-02-15 13:43:42+00:00,Just read 20 articles about Bitcoin. Interesting concept. I don't think it will happen. Buuuut people said the same thing about TV,0,0,0,1
2014-02-15 12:55:34+00:00,"Bitcoin: Be prepared for the rise of digital currency, adopters say",0,0,0,0
2014-02-15 06:37:25+00:00,"“Dear sir, I am a Nigerian prince and want to temporarily store 1,000,000 bitcoin in your wallet. Simply send me your public key!”",0,0,0,0
2014-02-15 01:04:06+00:00,I told Erin that one of the local Coney Islands accepts Bitcoin. She asked “what is that?” After explaining it she said “sounds made-up”,0,0,2,0
2014-02-15 00:43:48+00:00,My son told me he wants to be a bitcoin when he grows up.,0,0,0,0
2014-02-14 22:37:35+00:00,I had to write a paper on Bitcoin so not only does it suck for that reason but after knowing what it actually is I was like no thanks,1,0,0,0
2014-02-14 21:42:19+00:00,"If it comes through, bitcoin will forever be my valentine",0,0,0,0
2014-02-14 20:13:25+00:00,"It's 2014, why can't I pay my HOA dues via credit card, paypal or bitcoin?",2,0,1,0
2014-02-14 16:05:52+00:00,"That’s right bitcoin, I believe in you!",0,0,0,0
2014-02-14 14:30:24+00:00,BITCOIN RATE AM today $631.06 in US DOLLARS.,0,0,0,0
2014-02-14 10:33:52+00:00,Bitcoin mentioned in House of Cards Season 2 Episode 2. Lmao!,0,0,0,0
2014-02-14 07:51:42+00:00,My 7970 got 650kh/s. I sold it to a bitcoin miner. It's probably being used to mine doge coin right now.,3,0,0,1
2014-02-14 06:44:22+00:00,Learning about Bitcoin. Mind =💥💨,0,0,0,0
2014-02-14 04:14:56+00:00,Right now could be a good time to buy some Bitcoin y'all.,0,0,0,1
2014-02-14 04:11:12+00:00,"""The Secret Studio"" located at 661 suite 101, W Lancaster Blvd., Lancaster CA, has started accepting bitcoin and litecoin.",1,0,0,0
2014-02-14 03:46:31+00:00,Bitcoin crashing on exchange ddos fears. Hit $302 on gox 538 on stamp. Time to buy,0,0,0,0
2014-02-14 03:20:42+00:00,Oh dear God Bitcoin is in a death spiral,0,0,0,0
2014-02-14 03:04:33+00:00,People who put citations in HN comments (especially in bitcoin threads) are my favorite sort of HNers.,0,0,1,0
2014-02-14 02:54:05+00:00,Perceived value is the new bitcoin,1,0,0,0
2014-02-14 02:35:16+00:00,Bitcoin! ! Wow!,0,0,0,0
2014-02-14 02:14:27+00:00,I could use some good Bitcoin news about now.,0,0,1,0
2014-02-14 02:11:36+00:00,Bitcoin certainly is *comedic* gold.,3,0,1,1
2014-02-14 01:14:29+00:00,Bitcoin hacked! Millions Stolen! who could have saw that coming!! Besides anyone with a brain!,0,0,0,1
2014-02-14 00:37:34+00:00,Apparently a Bitcoin mining rig doesn't make a good valentines day present.,1,0,0,1
2014-02-14 00:19:01+00:00,I've figured out this Bitcoin thing. It's actually a surprise hacker competition sponsored by the NSA.,0,0,0,0
2014-02-13 23:44:35+00:00,I'm heavy in bitcoin,0,0,0,0
2014-02-13 23:38:44+00:00,"The Silk Road 2 was hacked. Lost $2.7 million in Bitcoin. Wait, $5.5 million. Hold on, just 50 cents. Uhh.. Now they lost $80 trillion.",0,0,1,1
2014-02-13 22:16:26+00:00,"Just in time for Valentine’s Day, FTD now accepting bitcoin* 

*only valid for tulips",6,0,0,1
2014-02-13 22:15:54+00:00,someone explain bitcoin to me,2,0,2,0
2014-02-13 22:08:26+00:00,"When I tried getting into bitcoin it was only worth 23 dollars per btc , it blew my mind but I didn't have a strong enough computer to mine",0,0,0,0
2014-02-13 20:05:17+00:00,Bitcoin is almost mainstream.,3,0,2,3
2014-02-13 19:07:23+00:00,What if Bitcoin becomes the new world Currency???,0,0,0,0
2014-02-13 17:06:55+00:00,I haven't had time to figure out what a Bitcoin is,3,0,0,1
2014-02-13 06:25:58+00:00,Do you sometimes wish you had a slight heroin problem just for the reason that you'd have stocked up on bitcoin back in Silk Road's heyday?,1,0,1,0
2014-02-13 02:08:32+00:00,"All I want for my birthday is kandi, kandi supplies, an Ultra ticket, and a BitCoin. Not too much to ask for eh?",2,0,0,0
2014-02-12 14:34:12+00:00,"Crazy Eddie Memoirs: If we had bitcoin in our day, we would have laundered more money more efficiently.",3,0,0,0
2014-02-12 04:02:38+00:00,I’ll know Bitcoin has succeeded when I can type the bitcoin symbol. $ € ¥ £ ¢,1,0,0,0
2014-02-12 01:53:52+00:00,You know how you make the Apple bitcoin issue go away? Make a damn web app.,0,0,0,1
2014-02-12 00:16:08+00:00,Bitcoin panel at Goldman Sachs tech event in San Francisco attracting a full house of institutional investor types.,3,0,0,6
2014-02-12 00:14:25+00:00,Bitcoin was fine until someone was needed to defend it. An actual legit use for a military,0,0,0,0
2014-02-11 23:45:11+00:00,I’m at Omaha Bitcoin early! Come join me!,1,0,0,0
2014-02-11 23:12:44+00:00,I make money with bitcoin,0,0,0,0
2014-02-11 21:12:55+00:00,"When bitcoin stops falling, buy more.",0,0,1,0
2014-02-11 21:03:52+00:00,"Bitcoin sitting at $650, which confirms Jamison’s Law of Investing: “If Jamison has heard of it it is too late.”",3,0,1,0
2014-02-11 18:26:34+00:00,Pams is trading his bitcoin in class lol,4,0,0,0
2014-02-11 17:31:36+00:00,Bitcoin: the security of cash with the convenience of foreign traveler's checks.,0,0,0,0
2014-02-11 17:22:00+00:00,Still can't tell if BitCoin is genius or stupid.,0,0,0,0
2014-02-11 15:24:34+00:00,I see that BitCoin has lost all of it's street cred.,1,0,0,0
2014-02-11 14:44:20+00:00,What is Bitcoin trading at right now?,1,0,2,0
2014-02-11 14:24:49+00:00,The bitcoin just crashed wtf,0,0,0,0
2014-02-11 13:49:45+00:00,bitcoin go back to &gt;$1000,0,0,0,0
2014-02-11 06:37:16+00:00,"Bitcoin is a small piece in the bigger puzzle....will eventually happen.  I think. Architectures will transform as well, even flow... 20yrs",1,0,0,2
2014-02-11 06:07:35+00:00,"Seriously, I still don't get what is so cool about bitcoin.",0,0,0,0
2014-02-11 04:44:17+00:00,Bing just got better with microsoft teaming up with bitcoin.,0,0,0,0
2014-02-11 03:32:45+00:00,So Mt. Gox is blaming Bitcoin for it's problems? Isn't that like blaming the US Mint because you can't balance a checkbook?,0,0,0,0
2014-02-11 01:33:20+00:00,Damnit bitcoin stop recovering - I haven't bought more of you yet!,1,0,0,0
2014-02-10 19:00:16+00:00,Dumb Move: Charlie Shrem seems to be relishing his celebrity status after being indicted for alleged money laundering using bitcoin.,0,0,0,0
2014-02-10 18:44:13+00:00,Bitcoin plummets today.,0,0,0,0
2014-02-10 18:39:14+00:00,Seems like the issue with bitcoin arbitrage is mainly due to transferring dollars… which is obv one of the advantages of bitcoin.,0,0,0,0
2014-02-10 18:31:04+00:00,"I think you can stand to relax a little, nail salons that take bitcoin",1,0,0,2
2014-02-10 17:47:37+00:00,I suppose I should thank their idiocy for allowing me to scoop up more bitcoin for cheap.,0,0,0,0
2014-02-10 17:45:39+00:00,"Mt. Gox has the nerve to blame the bitcoin protocol for their failures. Nice try, guys. I'm glad I never started using them.",0,0,0,0
2014-02-10 17:11:47+00:00,"If any of you folks are panic selling a few Bitcoin, hit me up.",1,0,3,0
2014-02-10 14:23:03+00:00,Idea: RPG where the in-game currency for quest rewards and in-game shops is Bitcoin. Your GPU is used to mine for it as you play.,0,0,0,0
2014-02-10 13:56:06+00:00,"Wow, can't believe Mt. Gox would try to blame the withdrawal issues on the Bitcoin protocol instead of owning up to their own incompetence.",0,0,0,0
2014-02-10 08:22:36+00:00,It's like bitcoin remorse all over again,0,0,0,0
2014-02-10 05:19:49+00:00,I finally created a bitcoin wallet,0,0,0,0
2014-02-10 04:35:38+00:00,"signing my kid up for a week of robot/techie camp. Gives me a ""pay by Bitcoin"" option.",9,0,1,2
2014-02-10 04:01:22+00:00,"Regulators are itching to control Bitcoin, yet they haven't made any pull requests on GitHub. Code doesn't care about regulatory guidelines.",0,0,0,0
2014-02-10 02:48:08+00:00,bitcoin,0,0,0,0
2014-02-10 00:08:18+00:00,I should find that like .1 bitcoin if was tipped on Reddit that was like 2 dollars at the time.,0,0,0,0
2014-02-09 22:56:05+00:00,"Does this sound right? Current breakdown of Bitcoin transactions: 85% speculative, 13% illegal, 2% legitimate.",0,0,2,2
2014-02-09 22:54:11+00:00,"people don't realize that bitcoin is divisible. They see the price at $700 and think ""that's too expensive. I'll buy litecoin instead""",1,0,1,3
2014-02-09 22:23:47+00:00,I don't accept bitcoin but I do accept hand jobs.,1,0,0,0
2014-02-09 21:51:24+00:00,"Bitcoin is the new Napster.  (And by that, I’m referring to the old Napster).",0,0,0,0
2014-02-09 21:45:26+00:00,Investing in bitcoin is like investing in the internet. - Chamath Palihapitiya,0,0,0,0
2014-02-09 21:43:03+00:00,“Want to make a billion dollars? Buy a shit ton of Bitcoin!” - Chamath Palihapitiya,0,0,0,0
2014-02-09 20:12:04+00:00,Wish I invested in bitcoin a few months ago...,0,0,0,0
2014-02-09 16:38:48+00:00,What do you guys think about BitCoin? Bright future or just a fad??,0,0,1,0
2014-02-09 13:25:18+00:00,So I officially bought Bitcoin last month.  Nerdily studying the legal issues surrounding it - it's pretty cool how many areas it touches.,0,0,1,0
2014-02-09 00:16:11+00:00,What do you think of Mt. Gox suspending Bitcoin withdrawals and the prices dropping to $750? Time to buy or time to freak?,0,0,0,0
2014-02-08 21:40:00+00:00,There is now a USPS proposal to open a Bitcoin buying business at the post office next to the money orders. And it’s genius.,1,0,0,0
2014-02-08 18:56:09+00:00,I just learned all about bitcoin and the deep web and the Silk Road my mind is blown,2,0,0,0
2014-02-08 16:03:22+00:00,Bitcoin is not a currency. It’s a geek experiment.,0,0,1,0
2014-02-08 09:59:18+00:00,"I believe in Bitcoin as a technology, not sure it functions properly as a currency yet...",1,0,0,0
2014-02-08 09:58:00+00:00,"Interesting to see Mt. Gox not being the lead in Bitcoin pricing. Anyways, the premium seemed arbitrary at best.",0,0,0,0
2014-02-08 05:44:18+00:00,I still don't know what Bitcoin or Flappy Birds are and I'm perfectly content with that.,0,0,0,1
2014-02-08 03:40:05+00:00,"That the Russian AND the Chinese governments — both hugely invested in state-sponsored cybercrime — are so scared of Bitcoin, is telling.",0,0,0,0
2014-02-08 03:37:02+00:00,"""Now I ain't saying she a bitcoin digger...""",5,0,1,1
2014-02-08 03:01:25+00:00,Putin paid for the Olympics in bitcoin.,1,0,0,0
2014-02-08 00:42:10+00:00,Bitcoin &lt;$700 is a gift,0,0,0,0
2014-02-07 21:24:17+00:00,The cool thing about Bitcoin is that it is similar to money. But it isn't money because money doesn't fluctuate in value over 7%,0,0,0,0
2014-02-07 20:31:17+00:00,"BITCOIN US DOLLAR RATE $731 NOW

was $650 AM, $800 2 DAYS AGO, $1000, LAST WEEK SUNDAY, $500 PRIOR DAY...

FOOLS MONEY!",0,0,0,0
2014-02-07 20:27:30+00:00,I don't get the purpose of bitcoin. They should give me some free coins to get started.,0,0,0,0
2014-02-07 19:40:24+00:00,"The next time I hear someone say, “It’s not like you can pinch a bitcoin between your teeth,” I will strike their throat.",0,0,0,0
2014-02-07 18:31:45+00:00,"Postal service considering Bitcoin payments. The Times ignores. Naw, that's not newsworthy: Gov agency taking cryptocoin? No biggie. Not.",1,0,0,0
2014-02-07 13:29:57+00:00,Could bitcoin help alleviate pressure on Ukrainian currency? Especially since it's exchange rate has dropped,0,0,0,0
2014-02-07 11:30:39+00:00,Bitcoin dropped madd,0,0,0,0
2014-02-07 07:31:18+00:00,"OH on Caltrain: I made $80 in referrals, but it was all bitcoin.",5,0,1,1
2014-02-07 01:40:31+00:00,How many bitcoin I gotta throw samsung to put some more diamonds in that smart watch deal???,0,0,0,0
2014-02-07 00:56:06+00:00,"""Oh so they arrested the Vice Chair of the Bitcoin foundation? Glad my tax dollars got spent on that shit!""",0,0,0,0
2014-02-07 00:12:44+00:00,BITCOIN rate today $762,1,0,0,0
2014-02-06 22:42:24+00:00,"Donate or share to the slap the Bieber fund. 

Bitcoin address below

1KTLcobJJztXU6oaEBNRL97wMo198KrEDG",0,0,0,0
2014-02-06 18:59:41+00:00,Random thought: Couldn’t desktop software be monetized by building in Bitcoin mining?,1,0,3,0
2014-02-06 17:39:43+00:00,Bitcoin denied by Apple Store,4,0,0,0
2014-02-06 08:09:07+00:00,Decided to have Expensify reimburse me in Bitcoin. Mistake?,3,0,0,0
2014-02-06 05:53:35+00:00,"""There's no reason the US Postal Service shouldn't offer a bitcoin exchange service. All conceivable effects are positive for USPS &amp; gov't.""",0,0,0,1
2014-02-06 04:48:40+00:00,The establishment hates bitcoin,0,0,0,0
2014-02-06 04:14:41+00:00,Bitcoin is dropping...,0,0,0,0
2014-02-06 01:43:37+00:00,I've had $7 in my wallet for the last three weeks.  I've spent more bitcoin,0,0,0,0
2014-02-05 20:23:54+00:00,"I'm hiring someone to follow me around á la TI's ""what you know"" and punctuate my speech with ""What!"" and ""Ooh!"" and ""Ayyy!"". pay in bitcoin",0,0,0,0
2014-02-05 06:05:08+00:00,Hey guys I dropped a bitcoin.,0,0,0,0
2014-02-05 05:28:17+00:00,"A currency like Doge, with its never-ending mining reward, may end up having lower transaction fees than bitcoin: free.",0,0,0,0
2014-02-05 03:36:16+00:00,You'd think Silicon Valley was run on Bitcoin here.,1,0,0,1
2014-02-04 19:02:41+00:00,"Sharks, lasers, and a bitcoin all on one slide. Boom.",1,0,0,0
2014-02-04 13:12:19+00:00,What the f$&amp;@ is Bitcoin?,0,0,0,0
2014-02-04 05:34:50+00:00,does anybody use a desktop bitcoin wallet or a hosted web wallet is the way to go? catching up with tnx chain on my laptop seems impossible!,0,0,1,0
2014-02-04 02:24:16+00:00,Dude. I just realized. Bitcoin is going to make small claims court obsolete.,2,0,2,0
2014-02-03 21:53:11+00:00,"Credit, Debit, PayPal, Square, Google Wallet, Coin, Bitcoin",0,0,0,0
2014-02-03 20:38:10+00:00,Might be time to get into some BitCoin action.,1,0,1,0
2014-02-03 03:10:48+00:00,What hashtag do I have to tweet for a chance to win 1.5M Bitcoin?,0,0,0,0
2014-02-02 23:28:07+00:00,I wonder if the coin they are using is a Bitcoin.,0,0,0,1
2014-02-02 21:33:13+00:00,That horrible moment when you can't remember how you incremented the 30 character password for your bitcoin cold storage wallet...,0,0,1,0
2014-02-02 21:31:32+00:00,"Using bitcoin to bet on Super Bowl, watching 60"" 3D TV, drinking soylent &amp; have a computer strapped to my head.",1,0,4,1
2014-02-01 22:27:43+00:00,"So, Bitcoin... I am obsessed with knowing more about it. Matt says too risky of an investment. I'm now wondering how much Daniel owns today.",1,0,2,0
2014-02-01 19:30:49+00:00,I still don't really know what a Bitcoin is.,0,0,3,0
2014-02-01 15:40:08+00:00,"""BITCOIN IS THE FUTURE! !!!!!!!"" -Juri yelling at someone on the street last night.",1,0,1,0
2014-02-01 08:19:20+00:00,I am going to make a currency based entirely on cheese. Take that Bitcoin.,0,0,0,0
2014-02-01 06:44:02+00:00,"Me to bar employee: do you take debit?
His reply: yes--debit, credit and bitcoin.
Oh Miami!",0,0,0,0
2014-03-30 20:02:30+00:00,"""bitcoin is an irreversible guaranteed payment” TED talk. So is giving someone cash.",1,0,0,1
2014-03-30 16:56:02+00:00,One thing for sure is that Bitcoin has shown the power of open source software projects to even more people in the general public.,0,0,0,0
2014-03-30 15:08:15+00:00,"Been reading on Litecoin talk that ASICs remove the positive difference between Bitcoin &amp; Litecoin, The little guy can't get into the game.",0,0,0,0
2014-03-30 04:36:16+00:00,Facebook spending $19 billion on Whatsapp and $2 billion on Oculus Rift shows that the US dollar must be even more imaginary than Bitcoin.,1,0,0,0
2014-03-30 02:33:13+00:00,"You see your Bitcoin on fire
Don't try to act surprised
We did just what you told us
… found ourselves believing your lies",0,0,0,0
2014-03-30 02:31:25+00:00,Wish Bitcoin was something real wish Bitcoin was something true,0,0,0,0
2014-03-30 02:30:19+00:00,"This isn't meant to last, this is for right now

I know the Bitcoin is getting away and it comes to me as no surprise",0,0,0,0
2014-03-30 02:25:00+00:00,"what if this whole Bitcoin’s a charade?
and behind it all there’s a price to be paid
for the blood on which we dine",0,0,1,0
