2014-03-09 01:40:53+00:00,Added “bitcoin” and “SXSW” to mute filter,5,0,4,1
2014-03-09 01:33:41+00:00,I am now the proud owner of 0.01 bitcoin. Bow before the awesome power of my neckbeard.,0,0,1,0
2014-03-09 00:20:28+00:00,Just got my first spam about buying bitcoin! A watershed moment.,0,0,1,0
2014-03-09 00:15:05+00:00,Tip for Fraudsters: Bitcoin is the future. Interpersonal skills not required. ~ Felons For Bitcoin.,1,0,0,2
2014-03-08 21:31:30+00:00,Really hoping that somehow the Bitcoin &amp; Salazar/Schumacher sagas find a way to intertwine.,3,0,0,0
2014-03-08 20:34:25+00:00,I'm mining Bitcoin on my Blackberry,0,0,1,0
2014-03-08 19:08:17+00:00,Bitcoin. Yawn.,0,0,0,0
2014-03-08 19:00:10+00:00,"If he is the Bitcoin inventor, it's better for the currency this kerfuffle happens now than later.  Now, the early adopters set the pace.",0,0,0,1
2014-03-08 17:25:31+00:00,Tip for Fraudsters: I used to say that you can steal more with a smile than with a gun. But with bitcoin you can steal more with a keyboard,1,0,0,1
2014-03-08 16:51:07+00:00,Oh Hell..BITCOIN...got robbed (^o^),0,0,0,0
2014-03-08 16:45:36+00:00,"Only thing of value at Beckett is the grading. The news, magazine, and price guide are worth about as much as a Mt Gox Bitcoin.",1,0,0,2
2014-03-08 16:42:58+00:00,"If this is the death of the Bitcoin, could the birth of the Quatloo be far off? Or is it barter? Can you make change for a bale of hay?",0,0,0,0
2014-03-08 16:32:01+00:00,Satoshi from Bitcoin is kind of like Kira from Death Note.,0,0,0,0
2014-03-08 15:54:25+00:00,I'm giving up trying to understand Bitcoin and going back to watching funny dog videos.,10,0,3,1
2014-03-08 13:35:00+00:00,"If you have money in bitcoin, you probably deserve to lose it.",1,0,0,0
2014-03-08 11:00:43+00:00,"Several months ago, I started looking into what it intrinsic value is Bitcoin based on?",0,0,0,0
2014-03-08 07:57:25+00:00,How do I buy a bitcoin? I want one. Or 90.,1,0,0,1
2014-03-08 05:31:17+00:00,"Though initially quite credible sounding, the Newsweek/Bitcoin story is increasingly looking like a bad case of confirmation bias.",3,0,0,0
2014-03-08 04:26:33+00:00,Brought to you by Bitcoin.,0,0,0,0
2014-03-08 03:05:22+00:00,Many of us rather not upload to unknown entities our passport and mailing address just to get bitcoin. BTC-E fills this market desire.,1,0,0,0
2014-03-08 02:55:16+00:00,it's unknown who invented bitcoin?,0,0,1,0
2014-03-08 01:17:20+00:00,"I created bitcoin.*

*not really, but I'll gladly accept gifts of model trains etc.",0,0,0,0
2014-03-08 00:47:07+00:00,Python scripting and Bitcoin reading? Not a bad way to spend a flight.,0,0,1,0
2014-03-08 00:14:41+00:00,Made $60 on bitcoin.,2,0,1,0
2014-03-07 23:45:10+00:00,Is Bitcoin god?,0,0,0,0
2014-03-07 23:43:47+00:00,Maybe Bitcoin created us?,1,0,0,0
2014-03-07 23:42:12+00:00,Bitcoin Begins,0,0,0,0
2014-03-07 22:47:14+00:00,I'm only really interested in learning who Satoshi is to the extent that it is evidence that Bitcoin was or was not created by a government.,1,0,2,0
2014-03-07 22:43:03+00:00,here is my new kickstarter give me 9000 dollars to buy a fancy bitcoin miner thx,0,0,0,0
2014-03-07 22:19:19+00:00,"If your definition of Bitcoin involves any of the following:
Schroedinger's Cat
Quantum Mechanics
Derivatives
...you're doing it wrong.",0,0,0,0
2014-03-07 22:18:34+00:00,"Ok, I admit it - I invented Bitcoin",0,0,0,0
2014-03-07 22:05:42+00:00,Tip for Fraudsters: Stay the background and let the outspoken cultists defend bitcoin to their last dollar.,2,0,1,0
2014-03-07 21:51:36+00:00,Bitcoin burger with a side of meme fries,1,0,2,1
2014-03-07 21:35:28+00:00,"Certified Twitter Trolls you who love to ""play"" being ""Anonymous"" - appreciate your newfound interest in Bitcoin. Can Satoshi be a woman thx",0,0,0,1
2014-03-07 21:25:10+00:00,Still don't know what the fuck a bitcoin is.,0,0,1,0
2014-03-07 20:18:53+00:00,I got a Bitcoin stuck in my nose.,0,0,0,1
2014-03-07 19:44:35+00:00,Tired of the denial. I invented bitcoin.,1,0,0,0
2014-03-07 19:08:36+00:00,Da fuck is a bitcoin?,0,0,1,0
2014-03-07 18:47:57+00:00,Bitcoin rocks!! Kool investment!,0,0,0,0
2014-03-07 18:18:30+00:00,Vaping : Bitcoin :: Dip : Gold,7,0,1,2
2014-03-07 18:06:35+00:00,Lol to those who think bitcoin is going to work out,0,0,0,0
2014-03-07 18:02:50+00:00,I still don't understand what Bitcoin is and I'd prefer to keep it that way.,0,0,0,2
2014-03-07 17:37:38+00:00,"I don't get bitcoin hate. It's math, a beta product, and has the side effect of libertarians joining a one world government dependence.",0,0,0,0
2014-03-07 16:58:55+00:00,Stranded in parking garage.  Lost parking ticket so have to pay.  No wallet so can't pay.  If only they accept bitcoin.,0,0,1,0
2014-03-07 16:26:00+00:00,(Though I think it’s entirely credible to think that a 64-year-old engineer would have never heard of bitcoin. We live in bubbles!),0,0,1,0
2014-03-07 16:23:10+00:00,It's been really fun watching a system that I always found pretty silly tear itself to pieces over a few weeks. Long live Bitcoin!,0,0,1,0
2014-03-07 16:20:10+00:00,"Interesting to see what Tim Berners-Lee thinks of how the web is used today, re: Nakamoto/Bitcoin",0,0,0,0
2014-03-07 15:54:48+00:00,"Government regulation of Bitcoin is ""the greatest fear of my day-to-day life,"" says libertarian, revealing profound emotional emptiness.",12,0,0,6
2014-03-07 15:44:51+00:00,I'm rooting for Zuckerberg to buy BitCoin and deny the Winklevii into space,1,0,0,2
2014-03-07 15:20:12+00:00,Bitcoin is like the Twitch Plays Pokemon of money.,0,0,0,0
2014-03-07 15:03:03+00:00,PLOT TWIST: Bitcoin never existed in the first place.,2,0,0,0
2014-03-07 13:15:35+00:00,"I’m not bitcoin founder Satoshi Nakamoto, L.A. man says",1,0,0,0
2014-03-07 13:05:24+00:00,This Satoshi bitcoin-not-bitcoin guy is hilarious,0,0,0,0
2014-03-07 12:56:13+00:00,So what's the over/under on days until Newsweek rolls on the Bitcoin founder story?,2,0,1,0
2014-03-07 11:45:53+00:00,I feel like my fear of bitcoin is the first step to becoming old and unhip.,0,0,0,0
2014-03-07 11:12:28+00:00,Japan is saying Bitcoin is not a currency (like Kudlow) &amp; is therefore taxable.  European capitals also looking at this.  Must stamp out all,0,0,0,0
2014-03-07 08:56:00+00:00,The strongest evidence for Dorian Nakamoto being Bitcoin's Nakamoto is a crepe bought in 2011 with Bitcoins. You can't make this stuff up.,1,0,2,1
2014-03-07 07:55:30+00:00,The most shocking thing about the boss of bitcoin dying is finding the boss of bitcoin was a woman.,0,0,0,0
2014-03-07 06:23:31+00:00,"Actually, it was Kaiser Soze that wrote the original-original Bitcoin code. He also went by Kenji Suzuki though.",0,0,0,0
2014-03-07 06:19:17+00:00,"What if bitcoin was engineered by the NSA with a security flaw from day one, so as to create a traceable currency for illegal activities…",3,0,2,2
2014-03-07 05:56:28+00:00,Let me know when the artsy-fartsy documentary about Satoshi Nakomoto and Bitcoin comes out.,0,0,0,0
2014-03-07 05:56:19+00:00,Anyone think Bitcoin is a planned experiment developed by a university andor government to study the effects of currency developed w/ energy,0,0,0,0
2014-03-07 05:31:53+00:00,Tim Tebow is the Baron of Bitcoin,0,0,1,0
2014-03-07 05:21:14+00:00,So Bitcoin is The Picture of Dorian Nakamoto?,0,0,0,0
2014-03-07 04:57:33+00:00,I did not deny that I created Bitcoin.,0,0,0,0
2014-03-07 04:52:47+00:00,"Wow, all this time I thought Banksy invented Bitcoin.",6,0,1,2
2014-03-07 04:38:10+00:00,Driving from Santa Monica to Temple City to pick up some o them Bitcoin I lost at Mt.Gox,0,0,0,0
2014-03-07 04:33:00+00:00,"""Remember when Bitcoin was a thing?"" -Us in two years",0,0,0,0
2014-03-07 04:23:26+00:00,“It’s untraceable! I used a ripple exchange to have the Fiat currency converted to e-cash and then into bitcoin…”,2,0,0,0
2014-03-07 04:23:24+00:00,"I’m not super involved in the Bitcoin community, but I’m going to remain skeptical about this whole thing. OK, that’s all I got.",0,0,0,0
2014-03-07 04:13:17+00:00,"Ok, everyone just take a Bitcoin break. Breathe in, and cash out.",1,0,0,0
2014-03-07 03:52:57+00:00,All this bitcoin drama is great thanks mtv for producing this,0,0,0,0
2014-03-07 03:44:49+00:00,Finally read the Newsweek piece and expected a lot more evidence. Instead it's 2 quotes that don't even mention bitcoin,1,0,0,0
2014-03-07 03:44:08+00:00,I wish we could all replace those horrible gold coin stock photos with burritos when reporting about bitcoin,1,0,0,0
2014-03-07 03:35:44+00:00,"""We only take cash and bitcoin. """,1,0,0,0
2014-03-07 03:24:37+00:00,Bitcoin is so trendy.,0,0,0,0
2014-03-07 03:22:48+00:00,I keep jumping up and punching bricks but still not a single bitcoin! What am I missing?!,0,0,2,0
2014-03-07 02:47:38+00:00,Bitcoin? More like shitcoin. lol.,0,0,1,0
2014-03-07 02:43:07+00:00,Odd and suspicious people working for Bitcoin!,0,0,0,0
2014-03-07 02:41:13+00:00,A lot of odd news surrounding Bitcoin lately.,0,0,0,0
2014-03-07 02:22:49+00:00,“This is not BitCoin this is real money folks!” - Auctioneer at Churchill benefit.,0,0,0,0
2014-03-07 02:12:16+00:00,“Bitcoin is traded peer-to-peer unlike conventional money” HOW DO PEOPLE THINK DOLLARS WORK,0,0,0,1
2014-03-07 02:10:48+00:00,“I don’t care one bitcoin.”,3,0,0,4
2014-03-07 02:00:09+00:00,"Everybody stop talking about Bitcoin, and maybe it will go away.",0,0,0,1
2014-03-07 01:51:03+00:00,"Bitcoin not even a stock cause it's not a company, shit is a virtual currency.",0,0,0,0
2014-03-07 01:50:02+00:00,"All the piece says is he ""tacitly acknowledges"" his involvement with Bitcoin. What if he's just a sick elderly man with the wrong name?",1,0,1,2
2014-03-07 01:47:55+00:00,Any data or thoughts on how bitcoin effects monopoly ? Also does hanukah gelt have to change form?,2,0,0,0
2014-03-07 01:16:40+00:00,"*God reads about bitcoin founder in Newsweek* not this shit again, he whispers *pulls out cartridge, blows in it a bit* that should do it",9,0,0,2
2014-03-07 01:16:37+00:00,"I’ve been away from Twitter all day.

So from what I’m gathering there’s a white Bronco situation with a guy who may have invented bitcoin?!",3,0,0,0
2014-03-07 00:51:32+00:00,Bitcoin : Tech :: Ready for Hillary : Politics,4,0,1,2
2014-03-07 00:38:23+00:00,"Loving people angry at Newsweek over the story about Bitcoin’s crazy, borderline-abusive creator. It’s cool, you all look crazy. No worries.",0,0,0,1
2014-03-06 23:50:08+00:00,"I remember when a shave and a haircut cost two bits, not two Bitcoin.",0,0,0,0
2014-03-06 23:20:25+00:00,So the Bitcoin guy is in the unit upstairs from me.,0,0,1,0
2014-03-06 23:07:21+00:00,Journalists have tracked down the founder of Bitcoin and are sure to make his life a living hell over the next few months.,0,0,0,0
2014-03-06 23:06:35+00:00,I hope they turn the Bitcoin saga into a movie.,0,0,0,0
2014-03-06 21:32:05+00:00,L.A. reporters chasing after after AP reporter &amp; alleged Bitcoin founder.  LA biz/tech reporters finally have their own celebrity to chase.,0,0,0,0
2014-03-06 21:19:17+00:00,what's more fascinating - that the inventor of Bitcoin may have been found or that Newsweek broke the news.,0,0,0,0
2014-03-06 21:07:55+00:00,"(I almost didn’t make that bitcoin joke, but then…)",0,0,0,0
2014-03-06 20:59:39+00:00,"Tip for Fraudsters: If u control a public company, use it to launder money w/ bitcoin.  U can anonymously inflate MV by amount of PE ratio",0,0,0,0
2014-03-06 20:43:14+00:00,"Creator of Bitcoin, Satoshi Nakamoto, found in CA- and he graduated from Cal Poly! And I just gave a speech on Bitcoin yesterday...",0,0,0,0
2014-03-06 20:05:02+00:00,These a sad irony in the fact that by the time the Bitcoin movie is made there will be no bit coins left to produce it,0,0,0,0
2014-03-06 19:02:49+00:00,i still dont understand what a bitcoin is.. the hell is it.,0,0,1,0
2014-03-06 18:50:52+00:00,Bitcoin CEO found dead,0,0,0,0
2014-03-06 18:46:32+00:00,"With Bitcoin, Angry Birds could charge us 0.01c each time we throw a bird.",0,0,0,0
2014-03-06 18:45:44+00:00,Can you imagine the never witnessed before possibilities offered by Bitcoin in terms of nano payments?,0,0,0,0
2014-03-06 17:55:18+00:00,Turns out the secret bitcoin creator is Mario! Why are we surprised?,0,0,0,0
2014-03-06 17:25:11+00:00,Man... That BitCoin founder story has a LOT of 90%/probably/kinda/likely facts supporting the central premise.,1,0,0,1
2014-03-06 17:06:40+00:00,"Bitcoin was created to make it easier to import model railroad parts to California from the UK. Suddenly, I have *way* more respect for it.",9,0,0,2
2014-03-06 16:21:37+00:00,Savvy bitcoin investors have a solution 2 cyber-thieves &amp; online exchanges: print out their virtual savings &amp; hide them in the real world.,1,0,0,0
2014-03-06 16:18:50+00:00,"Whew, finally, Bitcoin has a face so they can focus on him now instead of real questions, just like with Assange and Snowden.",11,0,1,13
2014-03-06 16:08:36+00:00,"Like Bigfoot, the elusive founder of BitCoin tracked down in California.",0,0,0,0
2014-03-06 16:06:47+00:00,More and more people are scrambling to trade their real world assets for Bitcoin. Lakefront property for  sale.,0,0,0,0
2014-03-06 16:01:05+00:00,"“Imagine if Gmail were to close down. Would we say, the end of email has arrived? Of course not” Bitcoin Exchange recent events.",0,0,0,0
2014-03-06 15:54:57+00:00,i care more about thursday than bitcoin,0,0,0,0
2014-03-06 15:37:42+00:00,"Pretty sure that if you wanted to destroy bitcoin, a series of cyber robberies would be the way to do it.",0,0,1,0
2014-03-06 15:06:43+00:00,"Newsweek found the creator of bitcoin, and basically gave out his address. 

He’s not a criminal, and they said he has 400M of bitcoin…",0,0,0,0
2014-03-06 14:58:42+00:00,If email was bitcoin my inbox would be Mt. Gox.,1,0,1,0
2014-03-06 14:41:42+00:00,Article potentially outing founder of Bitcoin is really irresponsible of Newsweek. People have already found his address in Google Maps,0,0,0,0
2014-03-06 14:14:10+00:00,Bitcoin exchange CEO found dead,0,0,0,0
2014-03-06 14:03:31+00:00,"“Hear hear! I tip my fedora to you, Satoshi.” - /r/bitcoin",0,0,0,0
2014-03-06 13:55:10+00:00,I am Bitcoin rich! You can tell by just looking up at my cloud! ☁️💱,0,0,0,0
2014-03-06 13:51:30+00:00,I think I'm gonna start mining bitcoin when I get home.,0,0,2,0
2014-03-06 13:45:52+00:00,I'm rethinking the decision to convert all my liquid assets to bitcoin,0,0,0,0
2014-03-06 13:00:27+00:00,Who ever killed the Bitcoin CEO did all the major governments a favor... Wouldn't surprise me if the CIA set her death up,0,0,0,1
2014-03-06 06:01:13+00:00,Bitcoin transaction cleared through Coinbase today. Sent to cold storage. Pretty good so far.,0,0,0,0
2014-03-06 04:01:10+00:00,a bitcoin exchange got hacked! OMG a TLS/SSL implementation is broken! OMG Brian Krebs reported a days breach! Sound familiar?!”,1,0,0,0
2014-03-06 02:46:22+00:00,bitcoin backup drive is dead. good thing it was only a few :/,0,0,1,0
2014-03-06 02:30:43+00:00,"What I don't get about Bitcoin (after 2nd major theft in month): If every transaction is traceable, how can the coins not be recoverable?",2,0,2,3
2014-03-06 02:16:17+00:00,Not a good day for bitcoin ...,0,0,0,0
2014-03-06 00:27:46+00:00,So should I convert all my tax return money to Bitcoin or nah?,0,0,2,0
2014-03-05 23:49:52+00:00,"Today is a big rush Bitcoin Show, Bun Mee, Starbucks, SF Food Bank",0,0,1,0
2014-03-05 20:48:04+00:00,"So if all the Bitcoin in the world eventually gets stolen, can we then finally stop talking about it so much?",0,0,1,0
2014-03-05 19:27:59+00:00,Step 2 after you decide to do a Bitcoin startup? Hire security engineers.,0,0,1,0
2014-03-05 19:21:31+00:00,Free idea: a web app to create a new instance of Bitcoin's algorithms and protocol to start your own arbitrary crypto currency. *coin!,0,0,1,0
2014-03-05 18:07:39+00:00,Bitcoin Security as a Service,1,0,0,0
2014-03-05 17:13:47+00:00,Wonder if BitCoin pundits who coo as prices climb after heists @ exchanges also cheer when CC breaches don't affect a breached co's stock,0,0,0,0
2014-03-05 16:18:48+00:00,So what’s the Klout to Bitcoin exchange rate?,0,0,1,0
2014-03-05 15:48:29+00:00,"Flexcoin, Mt. Gox BitCoin heists. Wonder if those who continue to proclaim price ""stability"" lost any &amp; if they did, wld they be so bullish",0,0,0,1
2014-03-05 15:16:39+00:00,so the hot Xmas gift for 2014 is a Bitcoin Exchange that's more secure than an ATM,0,0,0,0
2014-03-05 14:26:39+00:00,"sorry homeless man I don't have any cash, do you accept bitcoin?",9,0,0,2
2014-03-05 04:11:27+00:00,I'd like to know what percentage of US dollars have been stolen at some point in their life...bitcoin is at 12% - my guess is higher,0,0,0,0
2014-03-05 02:57:24+00:00,"My favorite thing about ""Bitcoin"" is that it autocorrects to ""Bitchin"", which is consequently the only erroneous autocorrect that I enjoy.",0,0,1,0
2014-03-05 01:32:05+00:00,Bitcoin = Tulip Bulbs,0,0,0,0
2014-03-05 01:09:42+00:00,Memo to Multi-Level Marketing Nuts: Do you clowns like bitcoin too?,3,0,2,1
2014-03-05 00:18:48+00:00,"A BitCoin walks into 1000… No, 600… No, 400… No, 200! bars. The BTC authorities keep a close eye on it.",0,0,0,0
2014-03-05 00:13:51+00:00,"I don't get bitcoin b/c I can't see how it's not akin to the fiat currency they say it replaces. I mean, don't you buy it w/reserve notes?",0,0,1,0
2014-03-05 00:13:23+00:00,This authority then could issue rules and guidelines for bitcoin exchanges.,1,0,0,0
2014-03-05 00:12:03+00:00,With all these bitcoin problems it seems like they should have some kind of regulatory authority or something…,1,0,2,0
2014-03-04 23:54:52+00:00,Go bitcoin!,0,0,0,0
2014-03-04 23:44:34+00:00,"BitCoin this week exemplifies something I love about tech as a system. What doesn't kill a product (bugs, theft, DDoS...) makes it stronger.",8,0,1,5
2014-03-04 21:58:17+00:00,Bitcoin. ROFL.,0,0,0,0
2014-03-04 20:55:05+00:00,Rick Ross worth fluctuates more than Bitcoin breh,0,0,0,0
2014-03-04 20:45:42+00:00,"“The Bitcoin masses…have no actual interest in science, technology or even objective reality when it interferes with their market position.”",0,0,0,1
2014-03-04 19:47:48+00:00,"If you attack money, you are considered pious. But, if you attack bitcoin, its cultists want to burn you at the cross.",2,0,0,0
2014-03-04 19:18:18+00:00,"If money is God, then bitcoin is a pagan God.",2,0,3,0
2014-03-04 19:04:19+00:00,"If money is a religion, then bitcoin is a cult.",3,0,1,1
2014-03-04 18:52:12+00:00,I resolve to never again pretend I understand stock market or bitcoin prices,1,0,0,1
2014-03-04 18:47:21+00:00,"First Mt. Gox went down, now Flexcoin. Hundreds of thousands of dollars lost. Bad news for Bitcoin owners.",0,0,0,0
2014-03-04 17:08:04+00:00,Reading that Bitcoin exchanges are even more centralized than conventional exchanges.,0,0,0,0
2014-03-04 16:38:42+00:00,Media attack on Bitcoin resembles it's previous attack on BitTorrent.,0,0,0,1
2014-03-04 14:48:03+00:00,"2nd bitcoin bank closes, citing security breach, theft",0,0,0,0
2014-03-04 14:16:40+00:00,"Bitcoin Business Model:
Start Bitcoin exchange, Accept other peoples bitcoins, have buddy steal them, profit.",1,0,0,0
2014-03-04 13:03:11+00:00,Any Bitcoin believers out there?,0,0,1,0
2014-03-04 11:36:37+00:00,How would bitcoin be gone when it is legal in pretty much all of Europe? Buffet needs to get out of Omaha more often,0,0,0,0
2014-03-04 07:45:24+00:00,There's a bitcoin ATM..... This is the future,0,0,0,0
2014-03-04 03:11:36+00:00,So I’m guessing Krieger gonna sell all the coke and then bitcoin gonna fuck him over?,0,0,0,0
2014-03-04 01:45:29+00:00,BITCOIN? Will it make it's way into our cyber banks,0,0,0,0
2014-03-04 00:11:22+00:00,I started mining Bitcoin back when difficulty was below 100million. But my ASIC rig is losing the battle w math &amp; we’ve hit 3billion (cont),0,0,1,0
2014-03-03 23:10:07+00:00,"""Bitcoin bugs"" is too unwieldy, right? So are they bitbugs, or coinbugs?",2,0,4,0
2014-03-03 20:23:00+00:00,Biggest lulz about all this MTGox / Bitcoin stuff is all this important stuff written in PHP.,2,0,1,1
2014-03-03 18:51:59+00:00,"Bitcoin is the worst daytime soap opera in years: talentless actors, ludicrous plot twists, and low production values.",7,0,3,8
2014-03-03 17:57:05+00:00,"Warren Buffet is anti-Bitcoin, and coming from the money man himself......",0,0,0,0
2014-03-03 17:44:05+00:00,"Free BitCoin to the first 1000 people who install KNC Wallet from Play Store, sorry iPhone Junkies (KNC is reputable)",0,0,0,0
2014-03-03 16:51:33+00:00,Bitcoin .001-aire.,4,0,0,1
2014-03-03 16:50:46+00:00,"So has someone created a Bitcoin Wank tumblr yet? Because if not, we totally need one",2,0,2,1
2014-03-03 13:54:59+00:00,"The average Bitcoin user is 32 yr old libertarian male, 44% users self described libertarian, who tend to be white (in other studies).",0,0,0,0
2014-03-03 12:45:30+00:00,"Heh, MtGox got hacked and now people have bank routing numbers, IDs, &amp; more. /r/bitcoin’s suggestion: Use Target’s year of credit monitoring",0,0,1,0
2014-03-03 12:36:03+00:00,Resisting urge to ask TSA agent whether my Bitcoin stays in the bag or goes in a bin.,2,0,1,0
2014-03-03 05:10:37+00:00,Oh Bitcoin,0,0,0,0
2014-03-03 02:49:06+00:00,"Last RT: never stop laughing at Bitcoin, yet another easily-detectable scam  ""top dawg"" white dudes fell for.",0,0,0,0
2014-03-03 01:59:10+00:00,Catherine Martin's dress is made of Bitcoin.,8,0,0,5
2014-03-03 00:49:34+00:00,spending bitcoin online power up I no time,0,0,0,0
2014-03-03 00:30:39+00:00,How would I pay with a fraction of a Bitcoin? Say I want a piece of gum.,0,0,3,0
2014-03-02 21:04:38+00:00,Anyway some dude just sat down next to me and opened up his laptop to /r/bitcoin time to go,12,0,3,0
2014-03-02 20:43:59+00:00,What can I pay for with a Bitcoin?,0,0,5,0
2014-03-02 19:55:43+00:00,A plus from the recent bitcoin troubles - QR codes might finally be dead.,0,0,0,0
2014-03-02 18:35:57+00:00,starting to think bitcoin currency is in for a rude awakening,0,0,0,0
2014-03-02 15:12:21+00:00,what is with forbes' obsession over bitcoin,0,0,0,0
2014-03-02 08:12:11+00:00,"Bitcoin is not real money. But then again, neither is real money. Truth should be coin of the realm, but in short supply &amp; so far, untamed.",2,0,0,1
2014-03-02 05:27:51+00:00,"Hey remember when bitcoin was worthless until some VCs started pumping money into it?

Yeah, that.",1,0,0,2
2014-03-02 02:33:00+00:00,Oh Bitcoin. So many laughs.,0,0,0,1
2014-03-01 22:18:40+00:00,"Couldn't we reverse-split Bitcoin or something? Paying 0.00175 ""coins"" is cumbersome and hurts my brain both conceptually and math-wise",2,0,12,4
2014-03-01 22:05:14+00:00,Various countries are BANNING BITCOIN because it's a currency they can't regulate.,0,0,0,1
2014-03-01 19:59:31+00:00,Lego is the new Bitcoin.,2,0,0,0
2014-03-01 18:21:16+00:00,i can't believe i lost my 0.0000000009 bitcoins in this bitcoin scandal!,2,0,0,0
2014-03-01 17:50:37+00:00,Currency volatility could be hedge with cryptocurrencies. Bitcoin could be more exciting outside of USA,0,0,0,0
2014-03-01 17:48:52+00:00,"Beyond fees and simplicity, bitcoin and blockchain can have deep implications to developing (lean) economies.",0,0,0,0
2014-03-01 17:29:36+00:00,"Ppl who think bitcoin isn't currency argue recent heist proves point; no, that there /was/ a heist makes that argument invalid.",0,0,0,0
2014-03-01 17:13:01+00:00,Does Bitcoin go down this month.  I just see the whole theory crashing.,0,0,0,0
2014-03-01 15:43:45+00:00,Get with the Bitcoin or..stay broke :'(,0,0,0,0
2014-03-01 12:34:49+00:00,Mt. Gox proved to be a disaster. No amount of bitcoin boosterism will change that. Crypto-currency has yet to demonstrate a reason to exist.,1,0,1,0
2014-03-01 09:35:56+00:00,"Love the idea of Bitcoin, but I didn't buy any. Too risky. But kudos to those pushing forward and taking the risk. May make a better future",1,0,0,0
2014-03-01 05:36:30+00:00,People that can speak kingon also excel at trading bitcoin stocks and hoarding their virginities.,1,0,0,0
2014-03-01 04:38:35+00:00,People like to point and laugh at bitcoin people or the MRA stuff but the raging 12 year olds on the Music subreddit take the cake for me,0,0,0,0
2014-03-01 04:28:43+00:00,I want to mine for Bitcoin but I don't have thousands of dollars to build a computer,0,0,1,0
2014-03-01 04:25:59+00:00,Can you be an expert on Bitcoin without being an expert on macro-economics?,0,0,0,0
2014-03-01 03:32:13+00:00,"""Bitcoin is the Tamagotchi of currency!""
-Jon Stewart",2,0,0,0
2014-03-01 03:11:40+00:00,Bitcoin traders at MT GOX now want gov. help to recover their funds. I thought lack of regulations is the main reason they like Bitcoins.,0,0,0,0
2014-03-01 03:11:33+00:00,ATX to get first Bitcoin ATM in the US. The whole thing is as clear as MUD!!,1,0,2,0
2014-03-01 02:11:45+00:00,Apparently I'm an idiot. WTH is a bitcoin?,0,0,2,0
2014-03-01 01:51:59+00:00,It's also amazing how angry people get about Bitcoin. Both sides. What a weird hot button issue.,6,0,7,0
2014-03-01 01:41:45+00:00,I'm virtually confused about Bitcoin. Can't make heads or tails of it.,3,0,0,3
2014-03-01 01:38:18+00:00,You know when you try to explain complex problems to kids with candy/toys as examples? That's me with money exchanges and Bitcoin right now,9,0,1,4
2014-03-01 00:04:17+00:00,MtGox was the Lehman of Bitcoin.  Everyone who was paying attention saw there was a game of hot potato.,0,0,0,0
2014-04-29 20:23:25+00:00,Is it possible to purchase the Clippers with Bitcoin currency?,0,0,2,0
