2014-01-30 22:47:44+00:00,i'm officially the owner of bitcoin now 💰,0,0,0,0
2014-01-30 22:46:13+00:00,"Dear Apple,

Why don't you allow a Bitcoin wallet on my iPhone?   Please allow wallet apps in the App Store. 

Thank you.",0,0,0,0
2014-01-30 22:39:50+00:00,"Why would bitcoin ""distribute wealth"" better? That makes no logical sense.",0,0,0,0
2014-01-30 22:03:43+00:00,Why all the bitcoin/crypto rage today? Are people mad that they cant print money too?,0,0,1,0
2014-01-30 20:48:18+00:00,"Since Bitcoin has obsoleted USD, how do I change my perl5 sigils? 
my ฿foo = 'bar';",2,0,0,2
2014-01-30 15:58:02+00:00,Where can I buy a vape with bitcoin?,2,0,0,0
2014-01-30 13:57:36+00:00,Got bitcoin?,0,0,0,0
2014-01-30 11:51:57+00:00,"Ok, friends. I don't understand Bitcoin. I know what it is, its origins and who its inventors are but I still don't get how it works.",0,0,0,0
2014-01-30 07:09:50+00:00,"A friend that is very pro bitcoin said ""money—I mean bitcoin"" tonight. I laughed a lot. They didn't think it was that funny.",13,0,2,5
2014-01-30 05:27:02+00:00,So how many SoJs can you buy with one Bitcoin?,0,0,0,0
2014-01-30 04:33:06+00:00,if belly button lint was made of bitcoin I'd be soooooo rich.,1,0,1,0
2014-01-30 03:18:43+00:00,Bitcoin is a pyramid scam.  Why not sell cat dung? Some idiots will buy anything and some thieves will sell it.  That is why we have SEC.,0,0,0,0
2014-01-30 02:55:17+00:00,"I keep hearing that Bitcoin is not a fiat currency. If not, can I use it to buy cars other than Fiats?",4,0,1,7
2014-01-30 01:36:03+00:00,Oh God. The lawyers next to me are talking Bitcoin. Make it stop.,1,0,0,1
2014-01-29 20:15:42+00:00,"Well, it's finally happened folks.
I can now purchase firewood online.
With BitCoin.",0,0,1,0
2014-01-29 19:03:52+00:00,"""If Bitcoin did not exist, it would be necessary for Twitter jokemen to invent it."" -- BonerVoltaire69",1,0,0,0
2014-01-29 17:00:00+00:00,"Bitcoin is the McRib of currencies. Its perversity is not a defect, but a feature. The purpose of Bitcoin is to make currencies seem normal.",15,0,0,8
2014-01-29 15:31:08+00:00,Hello Bitcoin Wallet 😏,0,0,0,0
2014-01-29 15:09:14+00:00,Just bought my first tenth of a bitcoin. Here’s to hoping it pays for my daughter’s wedding in 25 years or so.,3,0,2,0
2014-01-29 09:16:22+00:00,"I'd actually consider getting paid in bitcoin just for shits and giggles, but I don't have a mortgage to pay or a family to feed or friends.",3,0,1,1
2014-01-29 08:02:25+00:00,Holy shit. I need to get my ass into bitcoin mining.,0,0,0,0
2014-01-29 06:16:35+00:00,Need some bitcoin,0,0,0,0
2014-01-29 01:50:23+00:00,The state of address is soon. Stay tuned for my sharp witted commentary on our nations biggest concerns. Like Bitcoin. Just WHAT is it???,0,0,0,0
2014-01-29 01:19:11+00:00,Does anyone have a good bitcoin wallet recomendation?,0,0,0,0
2014-01-29 00:48:35+00:00,So I guess bitcoin is really happening.,0,0,0,0
2014-01-28 23:10:38+00:00,Fell free to drop a few bitcoin's my way,0,0,0,0
2014-01-28 20:12:09+00:00,LONG_BITcoin,1,0,0,0
2014-01-28 17:50:44+00:00,Fred Wilson suggests creating Safe Harbor for Bitcoin entrepreneurs,0,0,0,0
2014-01-28 17:13:42+00:00,I feel like I should know this but what is a bitcoin,1,0,0,0
2014-01-28 16:25:11+00:00,We created something of such great monetary value from absolutely nothing. People went from bitcoin rich to dollar rich.,0,0,1,0
2014-01-28 16:19:46+00:00,Would bitcoin be as intriguing as it is if interest rates weren’t ~0%,0,0,0,0
2014-01-28 15:38:59+00:00,Saying that bitcoin is being used for money laundry so we need to ban it is weird. How about we just ban the US dollar?,0,0,0,0
2014-01-28 15:18:16+00:00,'member when I said Bitcoin was economic twerking? CEOs getting arrested is ratcheting it up.,1,0,0,0
2014-01-28 04:56:05+00:00,Still trying to understand this Bitcoin thing....,0,0,0,0
2014-01-27 23:29:03+00:00,Okay I need to figure out what the fuck bitcoin is and how it works because I feel like the last kid picked in gym right now.,0,0,0,0
2014-01-27 20:55:06+00:00,"Every. Single. Time. I see the word ""bitcoin"" my brain sees the word ""bicotin.""",0,0,0,0
2014-01-27 20:00:29+00:00,bbc on bitcoin: “But it may be better to think of its units as being virtual tokens that have value because enough people believe they do…”,0,0,0,0
2014-01-27 18:59:05+00:00,Bitcoin sellers in Silk Road case charged with conspiracy,0,0,0,0
2014-01-27 17:55:17+00:00,I still don't understand Bitcoin…,0,0,1,0
2014-01-27 17:41:25+00:00,Fuck there attacking Bitcoin!,0,0,0,0
2014-01-27 17:28:17+00:00,"...it &amp; he asked me how to spell it. ""P?"" ""BITCOIN"", I said. ""Ah yes, like a quarter."" He had no idea. Still very early days...",0,0,0,0
2014-01-27 16:25:45+00:00,"This was always coming.The CEO of Bitcoin Exchange has been arrested &amp; charged with money laundering related 1 Silk Road, say US prosecutors",0,0,0,0
2014-01-27 16:09:28+00:00,Bitcoin is fascinating,0,0,2,0
2014-01-27 15:00:45+00:00,NY Department of Financial Services begins two days of public hearings tomorrow on the regulation of Bitcoin and other virtual currencies.,0,0,0,0
2014-01-27 05:57:12+00:00,Just bought soylent with bitcoin. I think I'll need a bit of time to recover from the future shock,0,0,0,0
2014-01-27 00:24:36+00:00,"I see Bitcoin is finally going mainstream, they are even mentioning it on tv shows",0,0,0,0
2014-01-26 22:50:27+00:00,I've asked this question so many times and I get a complicated ass answer every time but seriously what the fuck is a bitcoin,0,0,1,1
2014-01-26 19:35:26+00:00,"Gold, silver, and vinyl records are nice to have.

CD's, DVD's and USD's becoming obsolete.

Bitcoin and digital downloading are the future.",1,0,0,0
2014-01-26 13:50:48+00:00,Bitcoin conferences are good for the BTC price it seems. During the Las Vegas show BTC broke through $1000 and just now it happened again!,0,0,2,0
2014-01-26 07:19:58+00:00,Why has no one combined git and bitcoin to decentralize control over Linux?,1,0,3,1
2014-01-26 04:02:38+00:00,Bitcoin CEOs swear a lot,0,0,0,0
2014-01-26 01:31:35+00:00,"""I just heard about this Bitcoin thing. Is it for real?"" - people on the East Coast",0,0,0,0
2014-01-25 21:26:40+00:00,“Should banks be buying bitcoin companies? No. Bitcoin companies should be buying banks.” – some Cypriot,1,0,0,0
2014-01-25 21:01:06+00:00,"# = #

Where the fuck is my bitcoin?",0,0,0,0
2014-01-25 19:24:14+00:00,"This couple came in and they work for Facebook. I had intense conversations on net neutrality, bitcoin, stocks, google, and privacy polices.",0,0,1,0
2014-01-25 17:56:07+00:00,Has Bitcoin use dropped in WA and CO?,0,0,0,0
2014-01-25 17:00:32+00:00,"Selling 3 year old who likes to get up at 5am, will accept Bitcoin.",6,0,2,0
2014-01-25 15:09:53+00:00,"Okay, so I think my weekend reading list is going to consist of economic inequality and bitcoin.",0,0,0,0
2014-01-25 15:08:45+00:00,Ross Ulbricht's attorney speaking at the bitcoin conference.,0,0,0,0
2014-01-25 07:00:37+00:00,Does anyone know any prostitutes who accept bitcoin? Asking for a friend.,0,0,0,0
2014-01-25 06:35:00+00:00,"Hype and speculation aside, I really like bitcoin as a payment method.",0,0,0,0
2014-01-25 04:17:57+00:00,"I guess I look enough like a ""libertarian kinda guy"" that a random dude in the airport would ask me if I'm going to a bitcoin convention..?",0,0,0,0
2014-01-24 19:07:44+00:00,Can I PLEASE have someone explain BITCOIN?,0,0,0,0
2014-01-24 12:57:33+00:00,Ugh really awful talk about bitcoin on wnpr.,0,0,0,0
2014-01-24 08:38:29+00:00,tell me one benefit that I will gain by paying with bitcoin instead of credit card.  just so that i can tell people that I am nerdy?,1,0,0,0
2014-01-24 08:36:57+00:00,bitcoin needs a killer app.  definitely not traditional ecommerce sites.,0,0,0,0
2014-01-24 08:36:13+00:00,"with all these companies start accepting bitcoin, why would someone switch from credit card to bitcoin?  credit card is so easy now.",0,0,0,0
2014-01-24 07:05:10+00:00,"OK, .06 of a Bitcoin bought.",2,0,0,0
2014-01-24 06:38:10+00:00,Is bitcoin going to be universal or zero?,0,0,0,0
2014-01-24 05:33:12+00:00,"Oh hellloooo Bitcoin dive! 

Time to buy soon.",0,0,0,0
2014-01-24 00:46:13+00:00,"Going to try my hand at this bitcoin thing. I know I'm super late to the trend, but whatever. Let me know if you wanna join me",0,0,1,0
2014-01-23 23:53:37+00:00,Lew says bitcoin may be illegal. Translation: that scares the hell out of the fed b/c they can't control it - yet.,0,0,0,0
2014-01-23 23:18:56+00:00,"These ""[Institution] now accepts payment in Bitcoin"" articles remind me of ""[Institution] now [doing thing] by email"" articles from the '90s",1,0,1,0
2014-01-23 23:12:13+00:00,Want loads of free press for your e-commerce startup? Just start accepting bitcoin. You’re welcome.,0,0,0,0
2014-01-23 21:36:44+00:00,I need to invest in bitcoin. Shit!,0,0,0,0
2014-01-23 21:14:07+00:00,Tigerdirect accepts bitcoin now.,0,0,1,0
2014-01-23 18:02:28+00:00,Bitcoin is the future. Simply because it's not tied to any nations individual economy or the world for that matter.,0,0,1,0
2014-01-23 14:00:16+00:00,Last night I dreamt I started mining Bitcoin. I clearly need help.,0,0,0,0
2014-01-23 04:02:33+00:00,one thing i don't understand about bitcoin is how it would survive its own popularity. won't banks create their own if it's seen as useful?,0,0,3,0
2014-01-23 04:01:40+00:00,wtf is a bitcoin.,0,0,1,0
2014-01-23 03:07:35+00:00,"I don't see the point of bitcoin said one of them, I can't remember which Krugman said that",0,0,0,0
2014-01-23 00:49:48+00:00,Can someone explain bitcoin to me?,0,0,0,0
2014-01-22 16:53:41+00:00,"I think I'm ready to leave the absurdity of Sundance. OH: Oh god, we got so drunk last night. I bet 40 Bitcoin on a pool game.",5,0,1,1
2014-01-22 14:42:27+00:00,"The more I look at the Bitcoin mining process, the more I know what I will do with my old machine when I rebuild it in a few weeks.",0,0,0,0
2014-01-22 14:11:43+00:00,"People are talking about Bitcoin but you shouldn't just talk, be part of it. Learn and use it. Bitcoin is another looming discontinuity",2,0,0,0
2014-01-22 10:01:42+00:00,I kinda want to try to use bitcoin to purchase stuff one day.,0,0,0,0
2014-01-22 08:15:35+00:00,A way to buy a Segway with bitcoin by looking at a QR code with your Google Glass.,10,0,1,8
2014-01-22 06:25:06+00:00,Does anyone understand bitcoin? It is so confusing but I want some 😋,0,0,1,0
2014-01-22 04:11:38+00:00,"You know you are in San Francisco, when the people at the table next to yours are discussing JavaScript frameworks and bitcoin",0,0,0,0
2014-01-22 01:57:52+00:00,Watching a detective figure out who started Bitcoin on The Good Wife. Painful.,0,0,0,0
2014-01-22 00:03:10+00:00,Someone want to explain bitcoin to me?,0,0,1,0
2014-01-21 21:34:51+00:00,"OH: ""Referral mining. It's like bitcoin mining, but for people.""",0,0,0,0
2014-01-21 19:57:12+00:00,"Sacramento Kings now 1st NBA team to accept Bitcoin and stream on Google Glass. Shouldn't they use this energy on, you know, winning games?!",0,0,1,0
2014-01-21 18:13:34+00:00,The online mattress shop I just ordered from accepts Bitcoin.,1,0,2,0
2014-01-21 14:30:23+00:00,Has folding@home taken a hit with the rise of bitcoin?,2,0,1,0
2014-01-21 07:48:30+00:00,"How many ""free"" (zero fee) bitcoin transactions have ""failed"" (were *never* included in a block due to low priority) &amp; ultimately discarded?",0,0,0,0
2014-01-21 03:47:27+00:00,"""Got change for a One?"" 1 Bitcoin = $821.99",0,0,0,0
2014-01-21 01:58:58+00:00,I watch the price of bitcoin as if I owned some.,0,0,0,0
2014-01-20 21:38:28+00:00,Fighting with a reader about the definition of Bitcoin. I have arrived.,2,0,0,0
2014-01-20 21:10:45+00:00,"""based on a combination of bitcoin and Doge, an internet meme that superimposes broken English in Comic Sans on pictures of Shiba Inu dogs""",0,0,1,0
2014-01-20 16:49:50+00:00,Who is working on bitcoin for cooking?,4,0,5,0
2014-01-20 08:42:47+00:00,Just looking up bitcoin memes,0,0,0,1
2014-01-20 06:43:55+00:00,I have almost 40 dollars worth  of bitcoin I forgot about...,0,0,0,0
2014-01-20 05:43:31+00:00,bitcoin is gonna be important or something man,0,0,0,0
2014-01-20 03:04:49+00:00,Trying to turn my PS4 into a bitcoin hash generator. It's not going well (haven't started).,0,0,0,0
2014-01-20 03:03:39+00:00,I think it's funny when smart people don't understand bitcoin in the sense that it only has the value that people ascribe to it,0,0,0,0
2014-01-19 20:17:59+00:00,“Bitcoin 2.0″ already? Ugh,0,0,1,0
2014-01-19 12:00:26+00:00,Had a dream that I had acquired a full Bitcoin. Going back to sleepworld now where I'm a thousandaire.,0,0,0,0
2014-01-19 04:30:06+00:00,All I hear is bitcoin bitcoin bitcoin...,0,0,0,0
2014-01-18 15:28:24+00:00,Who knows about the new bitcoin?,0,0,0,0
2014-01-17 23:03:23+00:00,At some point il prolly quit constantly monitoring the bitcoin price but I'm still in that honeymoon phase. Its a 24/7 sweat!,0,0,1,0
2014-01-17 17:48:31+00:00,I would be happy if I never heard another thing about Bitcoin,0,0,1,2
2014-01-17 16:56:57+00:00,BitCoin accepted as legal tender for all things Sacramento Kings. que interesante,0,0,0,0
2014-01-17 16:30:38+00:00,Really just want bitcoin to keep falling for a few days,0,0,1,0
2014-01-17 15:59:44+00:00,"A woman just described her office as traditional because people use Blackberries. Given bitcoin showroom on Broad St., she may have a point.",1,0,0,1
2014-01-17 15:37:57+00:00,Been talking to some guys in my field of work and was told Porn will start accepting bit coin as payment. Might be time to invest in bitcoin,0,0,2,0
2014-01-17 15:02:38+00:00,Is Bitcoin like Social Media?  Endlessly Mining For a Speculative ROI.,2,0,0,0
2014-01-17 14:34:19+00:00,When did bitcoin really arrive? When prostitutes in an episode of Criminal Mind uses to go off the grid,0,0,0,0
2014-01-17 12:50:57+00:00,Bitcoin is a peer-to-peer payment system &amp; digital currency introduced as open source software by pseudonymous developer Satoshi Nakamoto.,0,0,1,0
2014-01-17 12:33:44+00:00,Sacramento Kings are the first major professional sports franchise to accept Bitcoin virtual currency for ticket and merchandise purchases,2,0,0,2
2014-01-17 03:35:54+00:00,Can every TV show stop referencing Bitcoin,3,0,1,1
2014-01-17 01:55:52+00:00,a strip club that only takes bitcoin,1,0,0,0
2014-01-16 19:31:55+00:00,BitCoin is taking over the world,0,0,0,0
2014-01-16 18:52:04+00:00,basically rich indian dudes like bitcoin.,0,0,0,0
2014-01-16 18:08:46+00:00,According to this math book: I could buy my teachers car with my bitcoin.... And have some left over...,0,0,0,0
2014-01-16 16:54:46+00:00,First found out about Bitcoin in 2010 when they were worth about $0.08 each. Some dude just bout a Lamborghini for 214 of them. Brb suicide,1,0,0,0
2014-01-16 16:47:40+00:00,Bitcoin exchange rate is like $850 USD... It was like what $50 last year or so...,1,0,0,0
2014-01-16 16:30:16+00:00,What is the difference between Bitcoin and gold.,0,0,0,0
2014-01-16 16:27:10+00:00,"I'm striking out to mine Bitcoin for next week, wish me luck.",0,0,0,0
2014-01-16 16:04:08+00:00,Bitcoin Virtual Currency? 😳,0,0,0,0
2014-01-16 15:42:54+00:00,I like it when people who are too excited about bitcoin explain to you that it can be used for payment on the internet.,0,0,0,0
2014-01-16 15:28:42+00:00,People are using BitCoin to fund untraceable hits on people in controversial political positions.,0,0,0,0
2014-01-16 15:04:40+00:00,Do we really need a Techcrunch article every time someone new starts accepting Bitcoin?,2,0,0,0
2014-01-16 07:48:52+00:00,My bitcoin total is very slowly yet surely accumulating 💰💰💰,0,0,0,0
2014-01-16 06:59:30+00:00,"You bitcoin address is your first name, followed by your first pet, and the first street you lived on.",0,0,0,0
2014-01-16 06:10:42+00:00,Thinking about buying some Bitcoin. Crazy? Probably.,0,0,0,0
2014-01-16 02:02:58+00:00,I wish I could trade in my knowledge of all the lyrics to the ZOOM! theme song for something more valuable... like bitcoin mining algorithms,1,0,1,0
2014-01-15 23:30:52+00:00,I had a nightmare last night that Bitcoin dropped in value by $800,3,0,0,0
2014-01-15 20:10:45+00:00,Bitch on bloomberg talkin like bitcoin ain’t even worth her breath. She jus mad tho.,0,0,0,0
2014-01-15 19:58:33+00:00,Doesn’t having a million different cryptocurrencies destabilize the entire market for these things? Bitcoin has an uphill battle as it is.,0,0,1,0
2014-01-15 18:39:27+00:00,Wonder if hookers accept bitcoin yet?,0,0,0,0
2014-01-15 15:42:32+00:00,Bitcoin 'r us,0,0,0,0
2014-01-15 06:34:07+00:00,Bitcoin bruh,0,0,0,0
2014-01-15 03:29:28+00:00,Wow. Bitcoin reference in this week's Blacklist.,0,0,0,0
2014-01-15 01:27:14+00:00,I'm pretty sure I don't ever want to know what a bitcoin is,2,0,0,0
2014-01-14 23:51:19+00:00,"Okay I give, who is Bitcoin?",0,0,1,0
2014-01-14 22:25:10+00:00,bitcoin on The Blacklist,1,0,0,0
2014-01-14 21:30:44+00:00,"Wtf is ""bitcoin"" ?",0,0,0,0
2014-01-14 19:45:37+00:00,I just read something about the Coinye West bitcoin saga and I’m grounding myself from the Internet for the rest of the day.,1,0,0,0
2014-01-14 19:33:54+00:00,bitcoin gang or dont bang,0,0,0,1
2014-01-14 16:30:55+00:00,"lol &lt;i&gt;""should you be investing in bitcoin?""&lt;/i&gt;",0,0,0,0
2014-01-14 15:57:41+00:00,BitCoin farming?,0,0,0,0
2014-01-14 06:51:27+00:00,"Given that competition will eventually drive the profit of bitcoin mining to ~0, what should the price of bitcoin be? &amp; how about long-term?",1,0,2,0
2014-01-14 04:46:32+00:00,Bitcoin needs to hurry up and crash,0,0,0,0
2014-01-14 03:08:02+00:00,"""Mobile, mobile, mobile!""; ""Bitcoin, Bitcoin, Bitcoin!""; ""hardware, hardware, hardware!""",0,0,1,1
2014-01-14 02:11:46+00:00,"Still not really what a bitcoin is but apparently one bitcoin is equal to over $1,000 USD",1,0,0,0
2014-01-13 21:32:26+00:00,"""Bitcoin. The honey badger of money."" A real life billboard for an online currency.",0,0,0,0
2014-01-13 20:22:03+00:00,B.R.E.A.M. - Bitcoin Rules Everything Around Me,3,0,0,1
2014-01-13 16:45:14+00:00,Reading about bitcoin at work bc Sean lmao,1,0,1,0
2014-01-13 16:22:12+00:00,"To scale Bitcoin in Africa and get it beyond techies, the techies have to become the equivalent of mobilemoney agents. Educate, cash in/out",0,0,0,0
2014-01-13 16:19:21+00:00,"African payments is interesting. After years of trying to create a new normal with MobileMoney, along comes the Internet and with it Bitcoin",0,0,0,0
2014-01-13 14:03:29+00:00,♪ firin up my rig turn the AC on ♪ it's ninety-nine degrees at the crack of dawn ♪ it's the liiiiiiife of a bitcoin miner ♪,1,0,0,1
2014-01-13 13:59:47+00:00,is there a country song written yet about being a bitcoin miner. bc if someone can give me some buzzwords we can write this and get rich,12,0,3,8
2014-01-13 02:17:40+00:00,Can't buy into Bitcoin as money. Has no universally recognized stable intrinsic value. I could create a duplicate crypto-currency tomorrow!,1,0,1,0
2014-01-12 19:42:11+00:00,"Not to quibble over a somewhat minor point, but BFT is solved by proof-of-work chain, not Bitcoin itself.",6,0,1,2
2014-01-12 17:58:25+00:00,For some reason I'm interested and intrigued by bitcoin.,0,0,0,0
2014-01-12 17:51:17+00:00,"Bitcoin, thoughts?",0,0,0,0
2014-01-12 16:50:48+00:00,Feeling some FOMO about Bitcoin. How do you start using it? Wanna try but where to begin...,0,0,3,0
2014-01-12 15:20:57+00:00,"You know the saying ""those who can't do...teach"" can we start applying the same concept to bitcoin. ""Those who can't earn... Mine""",0,0,0,0
2014-01-12 01:55:54+00:00,"My take: Bitcoin likely to not be ""the one"" but something like it, very possibly, if adopted as a commerce transport layer",0,0,1,0
2014-01-12 01:37:27+00:00,"At ""American Girl"" actually paying to have a doll's hair styled. And they don't take bitcoin. Wtf.",1,0,0,0
2014-01-11 23:09:37+00:00,I can't believe overstock is accepting bitcoin. They will regret that sooner than later.,0,0,1,0
2014-01-11 21:43:40+00:00,just overheard someone brag about buying soylent with bitcoin.... regression to the meme,0,0,2,3
2014-01-11 20:34:13+00:00,My lawyer accepts BitCoin,3,0,0,1
2014-01-11 20:02:23+00:00,"OH ""If you were gay, bitcoin would be a great way to meet similar people""",0,0,1,0
2014-01-11 19:13:21+00:00,"The latest episode of Community started with a riff on “bitcoin” in the writer’s room, didn’t it.",0,0,0,0
2014-01-11 08:09:34+00:00,All it takes to get our attention for consult is one bitcoin:1L4ePefCq6jsY8JRaLd5epWdp36D2wTPmC?amount=1,0,0,0,0
2014-01-11 03:29:07+00:00,"So nobody I talk to messes with bitcoin? Wow, figured my twitter peeps would be the most to use them",0,0,0,0
2014-01-11 02:41:05+00:00,Do any of my wonderful followers use bitcoin?,0,0,0,0
2014-01-10 23:46:42+00:00,"If Coinstar dispensed Bitcoin, that could really help with BTC adoption.",3,0,3,5
2014-01-10 21:26:01+00:00,Am I dumb that I don't understand Bitcoin? What's the point/purpose?,0,0,0,0
2014-01-10 16:05:24+00:00,Terrified of being taken for Bitcoin apologist after last RT,0,0,0,0
2014-01-10 08:01:02+00:00,Yo that whole bitcoin system is literally insane. That may be a new way of life soon,0,0,0,0
2014-01-10 06:56:52+00:00,I still have no idea what Bitcoin is.,0,0,0,0
2014-01-10 03:45:30+00:00,Brand new sexy 85mm prime lens arrived today for my Nikon D7100! Purchase cost? Half a Bitcoin! Digital money to shoot digital memories.,0,0,0,0
2014-01-10 03:39:31+00:00,"""2014 will be the year of new layers of services on top of the bitcoin blockchain.""",0,0,0,0
2014-01-10 03:34:51+00:00,Andreas M. Antonopoulos giving an inspirational bitcoin talk to overflow crowd of 250 people @ LA meetup. Incredible growth and potential.,5,0,0,6
2014-01-10 03:17:42+00:00,Bitcoin meet up at Coloft is packed. Bitcoin is going mainstream this year...,0,0,1,0
2014-01-10 02:55:17+00:00,Bittorrent is a way to make it rain bitcoin.,0,0,0,0
2014-01-10 02:44:33+00:00,I hope the bitcoin source code has a bunch of GOTO statements in it.,1,0,0,0
2014-01-10 02:43:37+00:00,Is bitcoin webscale?,0,0,0,0
2014-01-10 00:34:56+00:00,"i want to buy a coffee w/ bitcoin so in 2015 i can say either (i) last year i bought a coffee for a $1b!, or (ii) i bought a coffee for $0!",2,0,0,2
2014-01-09 23:29:54+00:00,I'm now 97% sure that Cookie Clicker is just a Bitcoin mining operation.,1,0,0,0
2014-01-09 22:50:39+00:00,"What the heck is a ""bitcoin""?",2,0,0,0
2014-01-09 18:59:00+00:00,I’m sure it’s just because there’s no Bitcoin news today.,1,0,4,0
2014-01-09 18:57:15+00:00,BITCOIN FOR FED CHAIR.,1,0,1,0
2014-01-09 18:00:25+00:00,"""I don't fully understand how Bitcoin works, but then, I don't get Miley Cyrus either.""",0,0,0,0
2014-01-09 17:10:00+00:00,"If you invested in bitcoin roughly a year ago, your return percentage as of yesterday would have been 570. That shit is fucking crazy",0,0,0,0
2014-01-09 16:48:09+00:00,One more article on Bitcoin and I’ll stab my eyes out with plastic forks.,1,0,0,3
2014-01-09 15:43:22+00:00,I'm trying really hard not to be jealous of everyone who dumped a huge investment into BitCoin right now...,0,0,0,0
2014-01-09 09:55:49+00:00,I WANT A BITCOIN MINER.,2,0,0,0
2014-01-08 21:47:55+00:00,"My tech prediction for what will be hyped in media 2014 will be largely same as 2013 - meaning Bitcoin, 3d printing &amp; tech ipo's. Boring?",0,0,0,1
2014-01-08 19:51:48+00:00,I just got a Snapchat that said “what is bitcoin?”,3,0,1,0
2014-01-08 16:24:49+00:00,I’ve probably said this any number of times but I fucking hate Bitcoin.,0,0,0,0
2014-01-08 13:41:24+00:00,BI says Alibaba just banned Bitcoin.  Govt. finally concerned about money moving out of China?,1,0,0,0
2014-01-08 06:46:06+00:00,"Thinking of Bitcoin, value and integers. Can ideas be expressed voted on and discrete values ascribed in a public ledger? May solve patents",0,0,0,0
2014-01-08 06:23:03+00:00,Bitcoin is basically the worst,1,0,0,0
2014-01-08 00:52:29+00:00,"every time i see the ""arise bitcoin"" billboard in SF i think it says ""arse bitcoin"" and get confused &gt;.&lt;",12,0,3,0
2014-01-07 23:06:56+00:00,Sitting at the bar and over hear a guy talking about bitcoin. Hmm obviously I join in.,0,0,0,0
2014-01-07 21:40:28+00:00,"If bitcoin is such a great alternative currency, how come I'm constantly being told a bitcoin's value in us dollars?",0,0,0,0
2014-01-07 18:59:36+00:00,There is a new virtual currency launching very soon called Coinye West.  similar to bitcoin…..Started as a joke and now is real,1,0,0,0
2014-01-07 18:19:47+00:00,If the Kanye West themed Bitcoin currency takes off I wouldn't be surprised,0,0,0,0
2014-01-07 17:15:42+00:00,Especially if the researcher(s) could tie their results to Bitcoin security.,0,0,0,0
2014-01-07 17:07:13+00:00,"With hacking being the primary threat of Bitcoin security, finding larger prime numbers will experience a spark in relevance.",0,0,0,0
2014-01-07 14:43:22+00:00,"Awww yiss, got paid some bitcoin",0,0,0,0
2014-01-07 04:57:59+00:00,so glad nobody took my 20 Bitcoin's bet.,0,0,0,0
2014-01-07 03:11:29+00:00,Bitcoin taking a beating on the global market case of bad PR,0,0,0,0
2014-01-07 01:59:54+00:00,Still cant figure out how to mine bitcoin,0,0,0,0
2014-01-07 01:35:32+00:00,Will work for bitcoin,0,0,1,0
2014-01-06 19:16:34+00:00,Bitcoin is so fun to watch. Glad I didn't back out of it in the crash!,0,0,1,0
2014-01-06 19:15:29+00:00,Bitcoin &gt; $1000 again,0,0,0,0
2014-01-06 16:57:05+00:00,For retailers to use bitcoin would require real time pricing and currency conversion. Any startups working on that right now?,3,0,0,0
